rank,movie_code,movie_name,story,release_time,price,box_off_num,screen,play_num,country,distributor,naver_viewer,naver_reporter,naver_netizen,daum_viewer,high,1주차_매출,1주차_관객수,1주차_스크린수,1주차_상영횟수,1주차_누적매출액,1주차_누적관객수,2주차_매출,2주차_관객수,2주차_스크린수,2주차_상영횟수,2주차_누적매출액,2주차_누적관객수,3주차_매출,3주차_관객수,3주차_스크린수,3주차_상영횟수,3주차_누적매출액,3주차_누적관객수,category,staff,directors
126,20162365,신비한 동물사전,"1926년 뉴욕, ‘검은 존재’가 거리를 쑥대밭으로 만들고 미국의 마법의회 MACUSA의 대통령과 어둠의 마법사를 체포하는 오러의 수장 그레이브스가 이를 추적하는 혼돈 속에 영국의 마법사 뉴트 스캐맨더가 이 곳을 찾는다. 그의 목적은 세계 곳곳에 숨어있는 신비한 동물들을 찾기 위한 것. 여행을 하면서 다양한 크기의 신비한 동물을 구조해 안에 마법의 공간이 있는 가방에 넣어 다니며 보살핀다. 하지만 은행을 지나던 중 금은보화를 좋아하는 신비한 동물인 니플러가 가방 안에서 탈출을 하고 이 일로 전직 오러였던 티나와 노마지 제이콥과 엮이게 된다. 이 사고로 뉴트와 제이콥의 가방이 바뀌면서 신비한 동물들이 대거 탈출을 하고 그들은 동물들을 찾기 위해 뉴욕 곳곳을 누빈다. 한편, ‘검은 존재’의 횡포는 더욱 거세져 결국 인간 사회와 마법 사회를 발칵 뒤집는 사건이 발생하고, 이 모든 것이 뉴트의 소행이라는 오해를 받게 되는데…",2016/11/16,39365960288,4669702,1431,116374,미국,워너브러더스 코리아(주),8.69,7.08,8.18,7,0,16718524565,1936408,1431,31587,16718524565,1936408,12381777236,1457523,1258,40009,29100301801,3393931,6501193342,803007,1063,26075,35601495143,4196938,어드벤처,0,데이빗 예이츠
127,20112534,도가니,"2011년, 대한민국의 마음을 움직일 진실이 찾아온다. 믿을 수 없지만, 한 청각장애인학교에서 실제 일어난 사건입니다. 2000년부터 5년간 청각장애아를 상대로 교장과 교사들이 비인간적인 성폭력과 학대를 저질렀습니다. 인정하고 싶지 않지만 이 이야기는 진실입니다. 이제 이 끔찍한 진실을 마주해야 할 시간입니다.",2011/09/22,35567476000,4662926,756,88345,한국,(주)씨제이이엔엠,,6.92,9.27,9.4,0,7075199500,905988,644,10801,7880455500,1005094,12761584500,1675449,756,20162,20642040000,2680543,9023182000,1181599,745,21404,29665222000,3862142,드라마,289,황동혁
128,20080653,쿵푸 팬더,"‘평화의 계곡’에서 아버지의 국수 가게를 돕고 있는 팬더, 포. 아버지는 국수의 비법을 알려주어 가업을 잇게 하고 싶지만, 포의 관심사는 오로지 '쿵푸 마스터'. 가게 일은 뒷전으로 하고 쿵푸의 비법이 적힌 용문서의 전수자를 정하는 ‘무적의 5인방’ 대결을 보러 시합장을 찾은 포, 그런데 이게 웬일! 마을의 현인 우그웨이 대사부가 포를 용문서의 전수자로 점지하는 이변이 일어난다. 무적의 5인방은 물론 시푸 사부 역시 이 사태를 받아들이지 못하는 가운데, 용문서를 노리고 어둠의 감옥에서 탈출한 타이렁이 마을을 습격해오자 그를 막아야 하는 미션이 포에게 떨어지는데... 포는 쿵푸마스터로 거듭날 수 있을까? 아니... 포가 쿵푸를 할 수는 있을까? 똥배 안에 숨겨진 포스를 깨우기 위한 포의 도전이 시작된다!",2008/06/05,29998150000,4654266,563,79902,미국,CJ ENM,,7.8,9.02,8.7,0,8165477000,1264712,563,13018,8172498000,1265715,7805309000,1198058,515,18834,15977807000,2463773,5690532500,877219,477,15858,21668339500,3340992,애니메이션,0,마크 오스본
129,20113554,내 아내의 모든 것,"예쁘고 사랑스러운 외모, 완벽한 요리 실력, 때론 섹시하기까지. 남들이 보기엔 모든 것을 갖춘 최고의 여자 ‘정인’(임수정). 하지만 입만 열면 쏟아내는 불평과 독설로 인해 남편 ‘두현’(이선균)에겐 결혼생활 하루하루가 죽을 맛이다. 매일 수백 번씩 이혼을 결심하지만 아내가 무서워 이혼의 ‘이’자도 꺼내지 못하는 소심한 남편 두현. 그런 아내와 헤어질 방법은 단 하나뿐. 그녀가 먼저 두현을 떠나게 하는 것! 제발… 제 아내를 유혹해 주세요! 아내가 싫어하는 짓만 골라하며 소심한 반항을 해보지만 눈도 까딱 않는 정인으로 인해 두현은 절망에 빠진다. 하지만 어떤 여자든 사랑의 노예로 만들어 버리는 비범한 능력을 지녔다는 전설의 카사노바 ‘성기’(류승룡)를 만나 절호의 기회를 얻는 두현! 이제 은퇴를 선언하고 은둔의 삶을 선택한 그에게 두현은 카사노바 일생의 화룡점정을 위한 마지막 여자로 정인을 유혹해 달라고 부탁하는데…",2012/05/17,34224467500,4598985,563,91777,한국,(주)넥스트엔터테인먼트월드(NEW),,6.77,8.58,8.2,0,5219765000,684625,563,9963,5976535000,781253,7769101500,1042828,539,17409,13745636500,1824081,7235074500,967607,532,15533,20980711000,2791688,코미디,254,민규동
130,20070056,스파이더맨 3,"대중의 사랑을 듬뿍 받으며 진정한 영웅으로 거듭난 스파이더맨, 피터 파커(토비 맥과이어). 어느 날, 스파이더맨은 외계에서 온 수수께끼의 유기체인 심비오트(Symbiote)에 감염되고 스파이더맨은 오리지날 스파이더맨에서 블랙 슈트 스파이더맨으로 변화한다. 한층 업그레이드 되고 강력해진 파워를 얻게 된 스파이더맨은 자신의 힘에 도취되어 마음껏 세상을 즐긴다. 아버지의 복수를 위해 '뉴 고블린(제임스 프랑코)'이 된 해리와 물리 실험에 노출되어 능력을 얻게 된 피터의 삼촌을 죽인 진범 '샌드맨(토마스 헤이든 처치)'은 호시탐탐 스파이더맨을 노리는데... 한편, 피터의 삶에서도 변화의 조짐이 보인다. 직장 동료인 에디 브록(토퍼 그레이스)이 스파이더맨을 i아다니며 연신 특종을 잡아 신문사의 영웅으로 떠오르며 그를 위협한 것. 하지만 브록은 스파이더맨이 자신의 여자친구 그웬(브라이스 달라스 하워드)을 위험에서 구해준 후, 그녀의 관심이 온통 그에게 쏠리자 스파이더맨에게 증오의 감정을 갖게 된다. 그리고 그가 벗어 던진 심비오트가 브록에게 전이되어 가장 강력한 악당인 '베놈'으로 진화한다. 상상을 초월하는 힘을 지니게 된 스파이더맨과 그를 노리는 뉴 고블린, 샌드맨, 베놈과의 피할 수 없는 사상 최대의 대결이 시작된다!",2007/05/01,29511658000,4592309,806,79966,미국,한국소니픽쳐스릴리징브에나비스타영화㈜,,6,7.46,7.5,0,15362323500,2394747,806,21150,15367916500,2395546,8101487500,1254000,687,22393,23469404000,3649546,4050240000,631669,592,19870,27519644000,4281215,액션,0,샘 레이미
131,20144641,판도라,역대 최대 규모의 강진에 이어 원자력 폭발 사고까지 예고 없이 찾아온 초유의 재난 앞에 한반도는 일대 혼란에 휩싸이고 믿고 있던 컨트롤 타워마저 사정없이 흔들린다. 방사능 유출의 공포는 점차 극에 달하고 최악의 사태를 유발할 2차 폭발의 위험을 막기 위해 발전소 직원인 ‘재혁’과 그의 동료들은 목숨 건 사투를 시작하는데…!,2016/12/07,36069197064,4585116,1184,100273,한국,(주)넥스트엔터테인먼트월드(NEW),8.78,5.92,8.2,7.7,0,11652147810,1441716,1166,25213,11799350810,1459251,13002419352,1654397,1184,34515,24801770162,3113648,6359750202,822265,1134,20856,31161520364,3935913,드라마,636,박정우
132,20081169,맘마미아!,"그리스의 작은 섬에서 엄마 도나(메릴 스트립)와 살고 있는 소피(아만다 시프리드)는 행복한 결혼을 앞둔 신부. 그러나 완벽한 결혼을 꿈꾸는 그녀의 계획에 흠이 있다면 결혼식에 입장할 손을 잡고 아빠가 없다는 것! 우연히 엄마의 일기장을 발견한 소피는 아빠로 추정되는 세 남자의 이름을 찾게 되고 엄마의 이름으로 그들을 초대한다. 결혼식 전날, 소피가 초대한 세 남자(샘,해리, 빌)가 그리스 섬에 도착하면서 도나는 당황하게 되는데... 과연 소피의 아빠는 누구일까? 그리고 이들의 결혼식은 무사히 끝날 수 있을까?",2008/09/03,29697221850,4579773,451,111827,미국,유니버설픽쳐스인터내셔널 코리아(유),10,7.25,8.43,8.6,0,4583749000,685672,451,13046,5580116500,832491,5632017000,844959,421,16824,11212133500,1677450,6490691000,989060,415,15360,17702824500,2666510,로맨스,0,필리다 로이드
133,20188750,나쁜 녀석들: 더 무비,"교도소에 처음 입소한 19세 청년 ‘JR’은 범죄 세계에서 이미 이름을 알린 인물 ‘브랜든’을 만난다. 어리숙하지만 영리한 ‘JR’을 눈여겨보던 ‘브랜든’은 위험으로 가득 찬 교도소 생활을 편하게 만들어주는 대신, 그에게 자신의 계획에 협조할 것을 제안한다. 바로 먼저 출소하는 ‘JR’이 자신의 교도소 탈출을 돕고, 이후 함께 금괴 주조 시설을 습격해 금괴를 훔쳐내는 것. 배신이 판치는 범죄 세계, 두 남자는 자신의 인생을 바꿀 금괴를 훔쳐내기 위해 믿을 수도 의심할 수도 없는 서로의 손을 잡게 되는데...",2019/09/11,39560195124,4573902,1511,113938,한국,(주)씨제이이엔엠,8.17,4.83,6.44,6.2,0,23769729184,2671681,1511,33175,23849081684,2680930,10404072340,1225839,1285,40307,34253154024,3906769,4275687560,535456,1114,28999,38528841584,4442225,범죄,572,손용호
134,20070057,캐리비안의 해적: 세상의 끝에서,"해적의 시대가 종말을 향해 치닫게 되면서 동인도 회사의 커틀러 베켓 경 (톰 홀랜더 분)은 유령선 플라잉 더치맨 호와 그 선장 데비 존스 (빌 나이 분)를 통제할 힘을 갖게 된다. 더치맨 호는 제임스 노링턴 제독 (잭 데븐포트 분)의 지휘하에 5대양을 누비며 해적선들을 소탕하고 다닌다. 윌 터너 (올랜도 블룸 분)와 엘리자벳 스완(키이라 나이틀리 분), 바르보사 선장 (제프리 러쉬 분)는 플라잉 더치맨과 베켓의 함대에 맞서기 위해 해적 연맹의 아홉 영주들을 소집한다. 그러나 아홉명의 영주 중 빠진 사람이 한명 있었으니 그는 바로 잭 스패로우 선장 (조니 뎁 분). 최고의 해적 혹은 최악의 해적으로 꼽힐만한 인물 잭 스패로우는 2편에서 괴물 크라켄에게 먹혀 데비 존스의 저승으로 잡혀간바 있다. 잭을 구하기 위해 이들 세 사람은 티아 달마 (나오미 해리스 분), 핀텔 (리 아렌버그 분), 라게티 (매킨지 크룩 분)과 함께 싱가폴의 해적 영주 사오펭 (주윤발 분)을 찾아간다. 목적은 사오펭이 갖고 있는 해도와 선박. 잭을 무사히 구해낸 이들 앞엔, 그러나 또 다른 장벽이 있었으니 그것은 해적 연맹의 연합된 힘으로도 상대하기 벅찬 베켓의 함대와 플라잉 더치맨의 막강한 위력. 유일한 희망은 인간의 몸에 갇혀있는 바다의 여신 칼립소를 풀어주어 그녀의 도움을 받는 것 뿐이다. 배신에 배신이 쌓여가면서, 잭과 윌, 엘리자벳, 사오펭, 바르보사는 각자 깨닫게 된다. 피차 아무도 믿을수 없음을... 그러나 살아남기 위해 이들은 자신에게 유리한 편과 동맹을 맺게 되고 이윽고 최후의 결전이 벌어진다.",2007/05/23,29133447500,4571229,953,78007,미국,한국소니픽쳐스릴리징브에나비스타영화㈜,,6.2,8.21,8.9,0,15551258500,2457329,953,19646,15551258500,2457329,7134161000,1101390,773,23389,22685419500,3558719,3541306500,558589,709,13692,26226726000,4117308,액션,0,고어 버빈스키
135,20050219,가문의 위기(가문의 영광2),"최고 명문家 백호파의 대모 홍덕자 여사! 조직은 조직대로 무럭무럭 크고, 슬하의 세 아들은 나름(?) 믿음직하다. 그러나 반드시 이룩해야 할 단 하나의 과제가 남아 있었으니, 가문의 체질개선을 위한 ‘엘리트 며느리’ 모시기!! ‘홍여사’는 세 아들에게 자신의 환갑잔치 때까지 무조건 큰 며느리감을 데려오라는 명령을 내린다. 며느리감 물색에 나선 세 아들, 드디어 어디 내놔도 안 부끄러울 며느리 감을 발견했단다!! 근데 며느리 될 아이가 강력계 검사라고라고라? 가문의 영광을 이루려다 가문이 위태롭게 생겼다~! 과연 홍여사와 세 아들은 엘리트 며느리 모시기에 성공할 수 있을 것인가?",2005/09/07,28622355500,4529876,351,61009,한국,(주)쇼박스,,5,6.31,6.9,0,6557608500,1040778,351,10135,6618931500,1055879,7721367000,1215895,328,13048,14340298500,2271774,8163235000,1291437,327,12430,22503533500,3563211,코미디,177,정용기
136,20124062,연가시,"그 누구도 피할 수 없는 감염의 공포가 대한민국을 초토화시킨다! 고요한 새벽녘 한강에 뼈와 살가죽만 남은 참혹한 몰골의 시체들이 떠오른다. 이를 비롯해 전국 방방곡곡의 하천에서 변사체들이 발견되기 시작하는데… 원인은 숙주인 인간의 뇌를 조종하여 물 속에 뛰어들도록 유도해 익사시키는 ‘변종 연가시’. 짧은 잠복기간과 치사율 100%, 4대강을 타고 급속하게 번져나가는 ‘연가시 재난’은 대한민국을 초토화시킨다. 사망자들이 기하급수적으로 늘어나게 되자 정부는 비상대책본부를 가동해 감염자 전원을 격리 수용하는 국가적인 대응태세에 돌입하지만, 이성을 잃은 감염자들은 통제를 뚫고 물가로 뛰쳐나가려고 발악한다. 한편, 일에 치여 가족들을 챙기지 못했던 제약회사 영업사원 재혁은 자신도 모르는 사이에 연가시에 감염 되어버린 아내와 아이들을 살리기 위해 치료제를 찾아 고군분투한다. 그 가운데 그는 재난사태와 관련된 심상치 않은 단서를 발견하고 사건 해결에 나서게 되는데…",2012/07/05,32176550664,4516063,759,71932,한국,(주)씨제이이엔엠,,5.46,7.16,6.7,0,9580073664,1326499,759,13109,9600707664,1329306,13576032500,1903029,733,25654,23176740164,3232335,6655364000,943625,658,20954,29832104164,4175960,공포,325,박정우
137,20090238,터미네이터 : 미래전쟁의 시작,"심판의 날 그 후, 뒤바뀐 미래 새로운 인류의 희망 ‘대니’(나탈리아 레이즈)를 지키기 위해 슈퍼 솔져 ‘그레이스’(맥켄지 데이비스)가 미래에서 찾아오고, ‘대니’를 제거하기 위한 터미네이터 ‘Rev-9’(가브리엘 루나)의 추격이 시작된다. 최첨단 기술력으로 무장한 최강의 적 터미네이터 ‘Rev-9’의 무차별적인 공격에 쫓기기 시작하던 ‘그레이스’와 ‘대니’ 앞에 터미네이터 헌터 ‘사라 코너’(린다 해밀턴)가 나타나 도움을 준다. 인류의 수호자이자 기계로 강화된 슈퍼 솔져 ‘그레이스’와 ‘사라 코너’는 ‘대니’를 지키기 위해 새로운 조력자를 찾아 나서고, 터미네이터 ‘Rev-9’은 그들의 뒤를 끈질기게 추격하는데... 더 이상 정해진 미래는 없다 지키려는 자 VS 제거하려는 자, 새로운 운명이 격돌한다!",2009/05/21,29690943500,4499776,702,93745,미국,롯데쇼핑㈜롯데엔터테인먼트,,6.59,8.19,7.7,0,11087402000,1673554,702,15064,11095520000,1675115,8236012000,1250589,601,23496,19331532000,2925704,5264314000,799334,523,20066,24595846000,3725038,SF,0,맥지
138,20170402,강철비,"북미 평화협정 체결을 위한 대한민국 대통령(정우성), 북한의 최고지도자인 위원장(유연석)과 미국 대통령(앵거스 맥페이든)간의 남북미 정상회담이 북한 원산에서 열린다. 북미 사이 좀처럼 이견이 좁혀지지 않는 가운데, 핵무기 포기와 평화체제 수립에 반발하는 북 호위총국장(곽도원)의 쿠데타가 발생하고, 납치된 세 정상은 북한 핵잠수함에 인질로 갇힌다. 그리고, 좁디 좁은 함장실 안, 예기치 못한 진정한 정상회담이 벌어지게 되는데… 동북아시아의 운명이 핵잠수함에 갇혔다! 과연, 남북미 세 지도자는 전쟁 위기를 막을 수 있을 것인가?",2017/12/14,35490646466,4452900,1426,80360,한국,(주)넥스트엔터테인먼트월드(NEW),8.73,7.18,8.33,8.5,0,13321001016,1643489,1426,23048,13334394016,1645140,11906057606,1511719,1390,29547,25240451622,3156859,6754445944,857434,909,14158,31994897566,4014293,액션,595,양우석
139,20090933,아이언맨 2,"세계 최강의 무기업체를 이끄는 CEO이자, 타고난 매력으로 셀러브리티 못지않은 화려한 삶을 살아가던 토니 스타크. 기자회견을 통해 자신이 아이언맨이라고 정체를 밝힌 이후, 정부로부터 아이언맨 수트를 국가에 귀속시키라는 압박을 받지만 이를 거부한 채 더욱 화려하고 주목 받는 나날을 보낸다. 스타크 인더스트리의 운영권까지 수석 비서였던 ‘페퍼포츠’에게 일임하고 슈퍼히어로로서의 인기를 만끽하며 지내던 토니 스타크. 하지만 그 시각, 아이언맨의 수트 기술을 ‘스타크’ 가문에 빼앗긴 후 쓸쓸히 돌아가신 아버지의 복수를 다짐해 온 ‘위플래시’는 수트의 원천 기술 개발에 성공, 치명적인 무기를 들고 직접 토니 스타크를 찾아 나선다. F-1 모나코 그랑프리에서 직접 경주용 차에 올라선 토니 스타크 앞에 나타난 위플래시! 무차별적으로 전기 채찍을 휘두르는 그의 공격에 무방비 상태였던 토니 스타크는 생명의 위협을 느끼지만, 새롭게 개발한 휴대용 수트 Mark5를 이용하여 간신히 위험에서 벗어난다. 그리고 자신과 자신의 아버지에 대해 강한 적대감을 드러내는 그에게서 심상치 않은 위기를 직감한다. 한편, 이 과정을 모두 지켜본 토니 스타크의 라이벌이자 무기업자인 ‘저스틴 해머’는 아이언맨에 필적할 만한 위플래시의 위력을 간파하고 그를 몰래 감옥에서 탈출시켜 자신과 손 잡을 것을 제안한다. 위플래시를 만난 이후 좀처럼 충격에서 헤어나오지 못하던 토니 스타크는 감옥에 갇혀 있는 줄 알았던 위플래시가 저스틴 해머와 함께 있음을 알게 되고, 역대 수트들을 뛰어넘는 최강의 위력을 지닌 Mark6 개발에 박차를 가한다. 그 사이, 저스틴 해머는 새로운 군무기 발표 쇼케이스를 개최하고, 그 곳에서 위플래시는 모두를 놀라게 할 작전 실행에 나서는데...! 줄거리 2. 자신이 아이언맨이라고 정체를 밝힌 뒤 할리우드 스타 못지 않은 인기를 누리던 토니 스타크. 스타크 인더스트리의 운영권을 수석 비서였던 페퍼포츠에게 일임하고 즐거운 나날을 보내던 그에게 생애 최고의 위기가 찾아온다. ‘스타크’ 가문에 대한 적대감으로 가득 찬 ‘위플래시’가 아이언맨 수트의 원천 기술인 아크 원자로 개발에 성공한 것. F-1 그랑프리에 출전하여 무방비 상태에 있던 토니 스타크에게 위협적인 공격을 가하는 위플래쉬. 이에 토니 스타크는 새로 개발한 업그레이드 수트를 이용, 겨우 위기를 모면한다. 하지만 이 사건을 계기로 위플래시는 토니 스타크의 라이벌 ‘저스틴 해머’와 손을 잡고 아이언맨을 공격하기 시작하고, 이에 토니 스타크는 오랜 동료 제임스 로드를 위한 새로운 하이테크 수트를 제작, ‘워 머신’으로 거듭난 그와 함께 강력해진 적들과의 본격적 대결에 나서는데…!",2010/04/29,32637290500,4425235,921,87672,미국,CJ ENM,,5.47,7.37,7.2,0,12374856000,1657987,853,17496,12374856000,1657987,12850114000,1759439,921,30971,25224970000,3417426,3992373500,538226,727,20729,29217343500,3955652,SF,0,존 파브로
140,20111009,해리포터와 죽음의 성물2,"모든 것을 끝낼 최후의 전투! 판타지의 아름다운 역사가 드디어 마침표를 찍는다! 덤블도어 교장이 남긴 ‘죽음의 성물’의 단서를 쫓던 해리 포터는 볼드모트가 그토록 찾아 다닌 절대적인 힘을 가진 지팡이의 비밀을 통해 드디어 마지막 퍼즐을 완성한다. 볼드모트의 영혼이 담긴 다섯 번째 ‘호크룩스’를 찾기 위해 마법학교 호그와트로 돌아온 해리와 친구들은 그들을 잡으려는 보안마법에 걸려 위기를 맞지만 덤블도어의 동생인 에버포스의 도움으로 벗어난다. 그리고 그에게서 덤블도어와 어둠의 마법사 그린델왈드에 관한 놀라운 과거에 대해 알게 된다. 한편, 볼드모트는 해리에 의해 호크룩스들이 파괴되었음을 느끼고 호그와트로 향한다. 해리를 주축으로 한 불사조 기사단과 죽음을 먹는 자들 간의 마법전투가 벌어지고 여기에 거대거미 아크로맨투라와 거인족 등 마법 생물들이 볼드모트 편으로 가세하면서 호그와트는 거대한 전쟁터로 변한다. 전쟁의 틈에서 해리는 덤블도어를 죽인 스네이프의 엄청난 비밀과 볼드모트를 죽일 마지막 호크룩스에 대한 단서를 알게 되는데...",2011/07/13,34668545500,4421210,757,70853,미국,워너브러더스 코리아(주),,8.36,9.33,9.2,0,13861372000,1745554,757,18944,13861372000,1745554,10029168500,1269435,671,20877,23890540500,3014989,5878258000,746512,513,16497,29768798500,3761501,판타지,0,데이빗 예이츠
141,20197922,다만 악에서 구하소서,"태국에서 충격적인 납치사건이 발생하고 마지막 청부살인 미션을 끝낸 암살자 인남(황정민)은 그것이 자신과 관계된 것임을 알게 된다. 인남은 곧바로 태국으로 향하고, 조력자 유이(박정민)를 만나 사건을 쫓기 시작한다. 한편, 자신의 형제가 인남에게 암살당한 것을 알게 된 레이(이정재). 무자비한 복수를 계획한 레이는 인남을 추격하기 위해 태국으로 향하는데... 처절한 암살자 VS 무자비한 추격자 멈출 수 없는 두 남자의 지독한 추격이 시작된다!",2020/08/05,38602532990,4357837,1998,193846,한국,(주)씨제이이엔엠,8.57,6.1,7.61,6.8,0,17749493740,2019937,1998,52221,17797226740,2025071,13653267730,1518114,1863,59273,31450494470,3543185,5011546460,562946,1573,44015,36462040930,4106131,범죄,381,홍원찬
142,20147669,엑스맨: 데이즈 오브 퓨처 패스트,천재 과학자 ‘트라스크’가 발명한 로봇 ‘센티넬’로 인해 사상 최악의 위기에 직면한 미래. 오랜 시간 적으로 맞섰던 ‘프로페서 X’와 ‘매그니토’는 돌연변이는 물론 인류를 위협하는 ‘센티넬’과의 전쟁을 막기 위해 ‘울버린’을 과거로 보낸다. 과거로 돌아간 ‘울버린’은 뿔뿔이 흩어졌던 엑스맨들을 모두 불러모아 인류의 미래를 구원할 거대한 전쟁을 시작하게 되는데…,2014/05/22,34654558766,4313871,1056,82722,미국,이십세기폭스코리아(주),8.76,7.53,8.89,7.9,0,14491118600,1755285,1056,20012,14497322600,1755849,10759744166,1349315,972,28129,25257066766,3105164,6607533000,851771,749,16503,31864599766,3956935,액션,4,브라이언 싱어
143,20080736,강철중: 공공의 적 1-1,"강동서 강력반 꼴통 형사 강철중(설경구). 5년이 지난 지금도 여전히 사건 현장을 누비고 다니지만 15년 차 형사생활에 남은 거라곤 달랑 전세 집 한 칸. 형사라는 직업 때문에 은행에서 전세금 대출받는 것도 여의치 않다. 잘해야 본전 잘 못하면 사망 혹은 병신이 될 수도 있는 빡센 형사생활에 넌더리가 난 그는 급기야 사표를 제출한다. 하지만 그때 한 고등학교에서 터진 살인사건 때문에 그의 사표 수리는 미뤄지고 이번 사건만 해결하면 퇴직금을 주겠다는 반장의 회유에 말려들어 귀찮은 사건 현장으로 돌아간다. 도무지 해결의 기미가 보이지 않던 살인사건은 죽은 학생의 지문이 얼마 전 강동서 관할에서 일어난 도축장 살인사건 현장에서 발견된 칼에 남겨진 지문과 같다는 사실이 밝혀지면서 새로운 국면을 맡는다. 강철중은 죽은 피해 학생과 어울려 다녔다는 친구 3명을 만나 단서를 찾기 시작한다. 아이들이 얼마 전 ‘거성’이란 회사에 취업했다는 사실을 알아낸 강철중은 이 사건이 ‘거성 그룹’과 관계 있다는 것을 감지하고 ‘거성 그룹’의 회장인 ‘이원술’(정재영)의 뒤를 쫓기 시작한다. 한편, 자신의 사업체마다 나타가서 훼방을 놓는 강철중 때문에 심기가 불편해진 이원술 역시 조용히 반격을 준비 하는 데…",2008/06/19,28638465100,4313102,707,74158,한국,"CJ ENM,(주)시네마서비스",,5.25,8.53,8.3,0,9250925000,1385133,707,13966,9251925000,1385383,8924650600,1334708,581,20533,18176575600,2720091,4677898500,708650,519,15145,22854474100,3428741,드라마,219,강우석
