rank,movie_code,movie_name,story,release_time,price,box_off_num,screen,play_num,country,distributor,naver_viewer,naver_reporter,naver_netizen,daum_viewer,high,1주차_매출,1주차_관객수,1주차_스크린수,1주차_상영횟수,1주차_누적매출액,1주차_누적관객수,2주차_매출,2주차_관객수,2주차_스크린수,2주차_상영횟수,2주차_누적매출액,2주차_누적관객수,3주차_매출,3주차_관객수,3주차_스크린수,3주차_상영횟수,3주차_누적매출액,3주차_누적관객수,category,staff,directors
358,20189123,곰돌이 푸 다시 만나 행복해,"“어른이 된 나 인생의 쉼표가 필요한 순간, 찾아온 나의 친구들 다시 만나 행복해” 어른이 된 나 로빈(이완 맥그리거)은 가족도 일도 모두 완벽해 보이지만, 한편 지쳐가는 일상 속에 서있다. 어느 날, 눈 앞에 가장 행복한 시간을 함께했던 비밀 친구 ‘곰돌이 푸와 일행’들이 다시 찾아오게 되고 뜻하지 않게 놀라운 모험 속에 빠져들게 되는데…",2018/10/03,4076578860,490307,536,0,미국,,8.94,6.33,8.98,8.6,0,1940960310,225803,536,8225,1957751310,227697,1418179900,168167,494,6965,3375931210,395864,475537850,63032,385,4115,3851469060,458896,어드벤처,0,마크 포스터
359,20169643,침묵,"재력과 사랑, 세상을 다 가진 남자 ‘임태산’(최민식) 모든 것이 완벽히 행복하다 믿었던 그 날 약혼녀이자 유명 가수인 ‘유나’(이하늬)가 살해 당하고, 용의자로 딸 ‘임미라’(이수경)가 지목된다. 세간의 이목이 집중된 사건 임태산은 그날의 일을 기억하지 못하는 딸을 무죄로 만들기 위해 자신만의 방식으로 사건을 쫓기 시작한다. 그리고 최고의 변호인단을 마다한 채, 미라의 무죄를 믿고 보듬어줄 젊은 변호사 ‘최희정’(박신혜)을 선임한다. 미라가 기억하지 못하는 시간을 둘러싼 치열한 법정 공방 하지만 사라진 그날의 CCTV 영상을 갖고 있는 유나의 팬 ‘김동명’(류준열)의 존재가 드러나며 사건은 예상치 못한 방향으로 흘러가는데... 살해된 약혼녀 용의자가 된 딸 가장 완벽한 날, 모든 것을 잃었다",2017/11/02,3873542364,487897,634,0,한국,(주)용필름,8.24,6.09,7.91,7,0,2438073464,300393,634,10444,2456105464,302647,1288304600,166287,601,10325,3744410064,468934,,,,,,,드라마,334,정지우
360,20199951,애나벨 집으로,"퇴마사 워렌 부부는 저주 받은 인형 애나벨을 발견하고 집에 있는 오컬트 뮤지엄 진열장에 격리시킨다. 또 다른 초자연적인 현상을 연구하기 위해 워렌 부부가 떠난 사이, 집에 남아있던 10살 딸 주디와 베이비시터는 ‘절대 들어가지 말라’는 경고를 어기고 마는데… 탈출한 애나벨은 모든 악령들을 깨우고, 잊을 수 없는 공포의 밤을 준비한다.",2019/06/26,3993147140,481766,653,0,미국,,7.5,4,6.21,5.5,0,2437635690,291158,653,9094,2439165690,291328,874712290,107166,577,3998,3313877980,398494,495955050,60543,262,2182,3809833030,459037,공포,1,게리 도버먼
361,20174369,변산,"발렛 파킹, 편의점 아르바이트로 빡센(?!) 청춘을 보내지만, 쇼미더머니 6년 개근의 열정을 불태우는 무명 래퍼 학수 a.k.a 심뻑(박정민). 또 다시 예선 탈락을 맞이한 인생 최악의 순간, 한 통의 전화를 받고 잊고 싶었던 고향 변산으로 향한다. 짝사랑 선미 (김고은)의 꼼수(?)에 제대로 낚여 고향에 강제로 소환된 학수. 징글징글하게 들러 붙는 옛 친구들로 인해 지우고 싶었던 흑역사는 하나, 둘 떠오르고 하루 빨리 고향을 뜨고 싶었던 학수는 예측 불허의 사건들을 겪으면서 인생 최대 위기를 맞이하게 되는데… 빡세지만 스웩 넘치고, 부끄럽지만 빛나는 청춘! 징하게 들러붙는 흑역사 정면 돌파가 시작된다!",2018/07/04,3886052473,474137,763,0,한국,변산문화산업전문(유),8.34,6.5,7.72,8.3,0,2226144723,264492,763,14014,2372185923,282199,1261217850,156292,610,9822,3633403773,438491,313805300,41765,466,2969,3947209073,480256,드라마,379,이준익
362,20182544,글래스,"24개의 인격 · 강철 같은 신체 · 천재적 두뇌 통제불가한 24번째 인격 비스트를 깨운 케빈, 강철 같은 신체 능력을 지닌 의문의 남자 던, 천재적 두뇌를 지닌 미스터리한 설계자 미스터 글래스, 마침내 그들이 한 자리에 모이게 되고 이들의 존재가 세상에 드러나면서 예상치 못한 일이 벌어지는데…….",2019/01/17,4277452982,466475,837,0,미국,,8.06,6.33,7.4,6.6,0,3119810372,339083,837,12858,3127922372,339707,1024975150,112753,735,9806,4152897522,452460,,,,,,,드라마,0,M. 나이트 샤말란
363,20170513,동네사람들,"여고생이 사라졌지만 너무나 평온한 시골의 한적한 마을, 기간제 교사로 새로 부임 온 외지 출신 체육교사 ‘기철(마동석)’은 동네 분위기가 심상치 않음을 감지한다. 실종된 여고생의 유일한 친구 '유진(김새론)'만이 친구가 납치된 거라 확신하여 사건을 쫓고, 의도치 않게 ‘유진’과 함께 사라진 소녀를 찾기 위해 나선 ‘기철’은 누군가에 의해 그녀의 흔적들이 사라지고 있다는 사실을 알게 되는데... 모두가 침묵하는 사라진 소녀, 하지만 누군가는 반드시 그녀를 찾아야만 한다",2018/11/07,3797676112,459020,731,0,한국,(주)에이치에스이디,7.12,4,5.23,5.3,0,2961809462,349542,731,14334,2982648462,352215,724797450,93410,687,7788,3707445912,445625,,,,,,,액션,198,임진순
364,20167903,원더풀 고스트,"딸 앞에선 바보지만 남의 일에는 1도 관심 없는 유도 관장 ‘장수’(마동석)에게 의욕과다 경찰 출신 고스트 ‘태진’(김영광)이 보이기 시작한다. 안 들리는 척, 안 보이는 척해도 ‘장수’에게 착! 달라붙은 고스트 ‘태진’은 그에게 자신과 함께 이 동네에서 일어나는 사건을 함께 수사할 것을 부탁하는데… 인간과 고스트의 신들린 합동수사가 시작된다!",2018/09/26,3720931600,450374,351,0,한국,(주)데이드림엔터테인먼트,7.99,4.83,6.61,7.6,0,3067983400,371425,351,8852,3123058600,377743,524480700,62167,324,4563,3647539300,439910,,,,,,,코미디,187,조원희
365,20192300,스파이 지니어스,"전 세계를 위협하는 불법 무기 거래 첩보를 입수한 스파이 에이전트는 천상천하 유아독존 슈퍼 스파이 ‘랜스’(윌 스미스)를 파견한다. 하지만, 최첨단 장비로 무장한 정체불명의 빌런 ‘킬리언’(벤 맨델슨)은 ‘랜스’로 위장해 무기를 훔치고 그를 함정에 빠트린다. 무기를 훔쳤다는 누명을 쓰고 스파이 에이전트에게까지 쫓기게 된 ‘랜스’는 ‘킬리언’에 맞서기 위해 MIT 출신의 엉뚱한 지니어스 ‘월터’(톰 홀랜드)를 찾아간다. 그러나, ‘월터’가 실험 중인 의문의 액체를 마시고 한순간에 세상 흔한 오조오억 비둘기로 변해버리고 만다. 혼자서는 세상을 구할 수 없는 ‘새’가 된 스파이 ‘랜스’는 힘을 합치면 세상을 구할 수 있다고 믿는 ‘새’가슴 지니어스 ‘월터’와 어쩔 수 없이 한 팀이 되어 특급 미션을 시작해야 하는데… 나는 놈 & 별난 놈, ‘새’ 상초월 극한 팀플레이가 시작된다!",2020/01/22,3689131180,449876,712,0,미국,,9.48,6.25,9.22,8.2,0,1879671710,224301,712,8952,1967111710,233583,1541082390,193881,706,9721,3508194100,427464,151929800,18810,491,3078,3660123900,446274,애니메이션,0,닉 브루노
366,20199541,미션 파서블,"“돈 되니까” VS “국가를 위해” 우린, 한다면 한다! 입금만 되면 뭐든 가능해지는 흥신소 사장 ‘우수한’ 앞에 어느 날 열정 충만 비밀 요원 ‘유다희’가 현금 천 만원과 함께 찾아 온다. 무기 밀매 사건을 해결하자며, 대놓고 공조를 요청해 온 것! 티격태격 하는 말마다 태클, 우당탕탕 하는 짓마다 사건! 혼자일 때보다 둘일 때 더 눈에 띄는 두 사람. 작전을 거듭해 갈수록 사건은 커져만 가고, 형사들이 오해할만한 단서를 여기저기 흘리고 다녀 수배 목록에 오르기도 하지만 우수한X유다희, 아찔한 이 공조를 멈출 수는 없다!",2021/02/17,4064099600,447048,930,0,한국,(주)노시스컴퍼니,8.42,4.5,7.18,6.8,0,1654864870,180320,930,15909,1659967870,180887,1330259610,150245,842,14100,2990227480,331132,758423350,80487,778,8805,3748650830,411619,코미디,246,김형주
367,20161762,반드시 잡는다,30년 전 해결되지 못한 장기 미제사건과 동일한 수법으로 또 다시 살인이 시작된다. 동네를 꿰뚫고 있는 터줏대감 ‘심덕수(백윤식)’는 사건을 잘 아는 전직 형사 ‘박평달(성동일)’과 의기투합해 범인을 잡으려 하는데… 발보다 빠른 촉과 감으로 반드시 놈을 잡아라!,2017/11/29,3324033772,446379,565,0,한국,(주)에이디사공육,8.11,6.5,7.44,6.8,0,2036292572,270275,565,12099,2087496572,276473,1014405100,137061,551,9763,3101901672,413534,218240100,32075,393,2569,3320141772,445609,스릴러,279,김홍선
368,20188462,감쪽같은 그녀,"“초면에 실례하겠습니다~” 72살 나 홀로 라이프를 즐기는 ‘말순’ 할매의 인생에 듣도 보도 못한 손녀(?)가 나타났다! 특기는 자수, 용돈 벌이는 그림 맞추기(?) 동네를 주름 잡으며 나 혼자 잘 살고 있던 ‘말순’ 할매 앞에 다짜고짜 자신을 손녀라고 소개하는 열두 살 ‘공주’가 갓난 동생 ‘진주’까지 업고 찾아온다. 외모, 성격, 취향까지 모든 것이 극과 극인 ‘말순’과 ‘공주’는 티격태격 하루도 조용할 날 없이 지내지만, 필요한 순간엔 든든한 내 편이 되어주며 서로에게 특별한 존재가 되어간다. 하지만 ‘말순’은 시간이 갈수록 ‘공주’와의 동거생활이 아득하고 깜깜하게만 느껴지는데…",2019/12/04,3377895790,436257,761,0,한국,(주)지오필름,8.82,5,7.7,8.2,0,1830108350,230875,761,12099,2047459350,263966,1254327300,163798,690,9658,3301786650,427764,278633780,39164,564,2818,3580420430,466928,드라마,300,허인무
369,20151230,원라인,"평범했던 대학생 ‘민재’는 모든 걸 속여 은행 돈을 빼내는, 일명 ‘작업 대출’계 전설의 베테랑 ‘장 과장’을 만나 업계의 샛별로 거듭난다. 환상의 케미를 자랑하며 돈이란 돈은 모두 쓸어 담던 5인의 신종 범죄 사기단! 그러나, 결코 서로를 믿을 수 없는 사기꾼들은 서서히 다른 속내를 드러내는데… 이름 나이 직업 모든 것을 속여라! 리얼 사기꾼들의 마지막 작업이 펼쳐진다!",2017/03/29,3310122433,433825,613,0,한국,(주)미인픽쳐스,8.68,5.71,8.17,7.5,0,2148670333,281706,613,10661,2226421333,291031,937200600,121668,554,7633,3163621933,412699,127256000,17417,346,2012,3290877933,430116,범죄,277,양경모
370,20181983,이웃사촌,백수가장 좌천위기 도청팀장 대권(정우)은 팀원들과 함께 해외에서 입국하자마자 자택 격리된 정치인 가족을 24시간 감시하라는 미션을 받는다. 이웃집으로 위장 이사온 도청팀원들은 라디오 사연 신청부터 한밤중에 나는 부스럭 소리까지 수상한 가족들의 모든 소리와 행동을 감시하면서 새로운 비밀들을 하나씩 발견하게 되는데… 담벼락 사이 수상한 이웃사촌들 웃고 울리는 비밀 소통작전이 펼쳐진다!,2020/11/25,3709121750,431559,1363,0,한국,(주)시네마허브,8.32,5,6.05,7.8,0,1569146580,183864,1363,21042,1712105580,200280,1099092240,126371,1233,21730,2811197820,326651,459301420,54323,932,11703,3270499240,380974,드라마,309,이환경
371,20184574,그린 북,"1962년 미국, 입담과 주먹만 믿고 살아가던 토니 발레롱가(비고 모텐슨)는 교양과 우아함 그 자체인 천재 피아니스트 돈 셜리(마허샬라 알리) 박사의 운전기사 면접을 보게 된다. 백악관에도 초청되는 등 미국 전역에서 콘서트 요청을 받으며 명성을 떨치고 있는 돈 셜리는 위험하기로 소문난 미국 남부 투어 공연을 떠나기로 결심하고, 투어 기간 동안 자신의 보디가드 겸 운전기사로 토니를 고용한다. 거친 인생을 살아온 토니 발레롱가와 교양과 기품을 지키며 살아온 돈 셜리 박사. 생각, 행동, 말투, 취향까지 달라도 너무 다른 두 사람은 그들을 위한 여행안내서 ‘그린북’에 의존해 특별한 남부 투어를 시작하는데…",2019/01/09,3603268560,429733,398,0,미국,,9.55,7.29,9.6,9.2,0,821545524,92682,398,4521,889374224,99569,640876950,73679,383,3676,1530251174,173248,317873700,37404,220,1947,1848124874,210652,드라마,0,피터 패럴리
372,20163845,터닝메카드W: 블랙미러의 부활,"지구 최초 메카니멀인 '디스크캐논'이 완성될 무렵 지구와 트라이포스에 이상한 기운이 감지된다. 소멸된 줄 알았던 블랙미러가 복수를 꿈꾸며 부활한 것! 시공을 넘어 현재로 온 블랙미러는 클론 메카니멀들을 이용해 도시를 파괴하고, 테이머들은 사상 최악의 위기 속 최후의 배틀을 준비하는데...",2017/01/18,3213263000,429569,570,0,한국,㈜희원엔터테인먼트,8.86,,8.74,7.7,0,2052777700,276158,570,6599,2056745700,276701,648090700,86062,438,4721,2704836400,362763,459238900,60092,392,2042,3164075300,422855,애니메이션,121,김석원
373,20191048,온워드: 단 하루의 기적,"마법이 사라진 세상에 살고 있는 취향과 성격 모두 정반대의 두 형제인 철든 동생 ‘이안’(톰 홀랜드)과 의욕충만 형 ‘발리’(크리스 프랫). ‘이안’은 태어나서 얼굴도 본 적 없는 아빠를 그리워하던 중, 서프라이즈 생일 선물로 아빠의 마법 지팡이를 받게 된다. 그러나 실수로, 아빠의 반쪽만 소환시키는 위기가 발생하는데!! 주어진 시간은 단 하루, 두 형제는 완벽한 모습의 아빠를 찾기 위해 모험을 떠나고 마법으로 절벽을 건너고, 까마귀 봉우리의 힌트를 따라 관문을 통과하지만 서로 다른 성격으로 인해, 사사건건 부딪히게 되고, 위험이 발생하는데… 과연 이들은 무사히 기적을 이룰 수 있을까? 기적을 향한 출발, 지금 당신을 만나러 갑니다.",2020/06/17,3581335060,416739,1138,0,미국,,9.11,6.33,9.03,8.6,0,1426229480,157299,1138,17954,1433516480,157986,1010263340,121865,834,11800,2443779820,279851,525313540,63185,597,7445,2969093360,343036,애니메이션,0,댄 스캔론
374,20176121,흥부: 글로 세상을 바꾼 자,"아무도 몰랐던 형제, 흥부 - 놀부 양반들의 권력 다툼으로 백성들의 삶이 날로 피폐해져 가던 조선 헌종 14년. 붓 하나로 조선 팔도를 들썩이게 만든 천재작가 ‘흥부’는 어릴 적 홍경래의 난으로 헤어진 형 ‘놀부’를 찾기 위해 글로써 자신의 이름을 알리려 한다. 모두가 알고 있는 형제, 조혁 - 조항리 수소문 끝에 형의 소식을 알고 있다는 ‘조혁’을 만나게 된 ‘흥부’는 모 잃은 아이들을 돌보며 백성들의 정신적 지도자로 존경 받는 ‘조혁’을 통해 새로운 깨달음을 얻는다. 한편, 백성을 생각하는 동생 ‘조혁’과 달리 권세에 눈이 먼 형 ‘조항리’의 야욕을 목격한 ‘흥부’는 전혀 다른 이 두 형제의 이야기를 쓰기로 결심한다. 그렇게 탄생한 ‘흥부전’은 순식간에 조선 전역에 퍼져나가고, 이를 지켜보던 ‘조항리’는 그를 이용해 조선을 삼킬 음모를 계획하는데…",2018/02/14,3381050200,416303,627,0,한국,(주)영화사 궁,6.88,4.57,4.43,5.5,0,2668853000,320751,627,9495,2681891000,322332,618862200,82317,540,7746,3300753200,404649,,,,,,,사극,394,조근현
375,20195915,해피 데스데이 2 유,절대 끝나지 않는 생일에 또다시 갇혀버린 트리와 더 강력하게 돌아온 베이비의 끝내주는 호러테이닝 무비,2019/02/14,3437809200,412850,657,0,미국,,8.27,6,7.33,6.3,0,2427006290,288142,657,9741,2427006290,288142,850400580,104255,590,7015,3277406870,392397,,,,,,,공포,0,크리스토퍼 랜던
376,20183915,극장판 공룡메카드: 타이니소어의 섬,"머나먼 옛날, 소행성 충돌로 인해 지구의 공룡들이 모두 사라지고 사람들에게 알려지지 않은 어느 작은 섬에서 공룡들은 아주 작은 모습의 타이니소어로 탄생한다. 씩씩한 트리케라, 장난꾸러기 티라노, 잠꾸러기 스테고 등 타이니소어 친구들이 도토리 축구를 하며 즐거운 나날을 보내고 있던 중, 수상한 악당들이 나타나 평화로운 ‘타이니소어의 섬’을 위협하기 시작하는데… 타이니소어들을 노리는 수상한 눈빛의 정체는? 과연 이들은 위기에 처한 지상 낙원 ‘타이니소어의 섬’을 지켜낼 수 있을까?",2019/01/10,3140214420,410131,763,0,한국,(주)초이락컨텐츠팩토리,9.17,5,9.15,6.8,0,2230727440,289224,763,7597,2236613440,289878,676177450,89691,568,5284,2912790890,379569,,,,,,,애니메이션,195,최신규
377,20171817,넛잡 2,"땅콩 털이에 성공 후 여유로운 삶을 즐기던 ‘설리’와 공원 친구들! 어느 날 갑자기, 영원할 것만 같던 땅콩 가게가 폭발하고, ‘설리’와 친구들은 어쩔 수 없이 ‘리버티 공원’으로 돌아가게 되지만 이마저도 악덕 시장의 놀이공원 건설 계획으로 파괴될 위기에 처한다. 더 이상 물러날 곳이 없는 ‘설리’와 친구들! 과연 악덕 시장에 맞서 공원을 지킬 수 있을까?",2017/10/03,3038945100,407727,526,0,한국,(주)레드로버,8.63,5,8.74,8.5,0,1859949200,245879,506,4687,1890392200,249939,788837500,106767,526,2936,2679229700,356706,,,,,,,애니메이션,106,캘런 브런커
378,20194424,소리도 없이,"범죄 조직의 하청을 받아 근면성실하고 전문적으로 시체 수습을 하며 살아가는 ‘태인’과 ‘창복’. 어느 날 단골이었던 범죄 조직의 실장 ‘용석’에게 부탁을 받고 유괴된 11살 아이 ‘초희’를 억지로 떠맡게 된다. 그런데 다음 날 다시 아이를 돌려주려던 두 사람 앞에 '용석'이 시체로 나타나고, 두 사람은 예기치 못한 사건에 휘말리게 되는데…",2020/10/15,3558023900,403326,1084,0,한국,(주)루이스 픽쳐스,7.83,7,5.92,6.7,0,1972259760,220090,1084,16117,1975248760,220433,1075122960,124591,1000,15410,3050371720,345024,412798370,47470,580,6975,3463170090,392494,범죄,264,홍의정
379,20198431,버즈 오브 프레이(할리 퀸의 황홀한 해방),"오랜 연인이던 조커와 헤어진 ‘할리 퀸(마고 로비)’은 처음 맞이한 해방에 황홀함을 느낀다. 하지만 조커라는 방패막이 사라지자 평생 처음 무방비 상태에 놓인 할리 퀸을 고담시에서 가장 비열한 범죄왕 로만 시오니스(이완 맥그리거)와 고담의 모든 갱들이 노린다. 통제 불능의 상태에서 카산드라라는 소매치기가 로만의 부하에게서 모든 권력과 고담시 지하 세계 전체의 지배권을 차지할 열쇠인 금융 정보가 암호화되어 있는 다이아몬드를 훔치면서 사건을 걷잡을 수 없이 급변한다. 로만 손에 죽을 위기에 처한 할리 퀸은 헌트리스, 블랙 카나리, 르네 몬토야와 새로운 팀을 결성해 로만에 맞서는데…",2020/02/05,3548999190,401411,963,0,미국,파라마운트 픽쳐스,8.23,6.4,6.43,5.8,0,2380447780,265235,963,22564,2389807780,265859,997365050,115766,871,13167,3387172830,381625,152588240,18247,456,2182,3539761070,399872,액션,0,캐시 얀
380,20193068,비와 당신의 이야기,"“이건 기다림에 관한 이야기다"" 뚜렷한 꿈도 목표도 없이 지루한 삼수 생활을 이어가던 ‘영호'(강하늘), 오랫동안 간직해온 기억 속 친구를 떠올리고 무작정 편지를 보낸다. 자신의 꿈은 찾지 못한 채 엄마와 함께 오래된 책방을 운영하는 ‘소희'(천우희)는 언니 ‘소연’에게 도착한 ‘영호'의 편지를 받게 된다. “몇 가지 규칙만 지켜줬으면 좋겠어. 질문하지 않기, 만나자고 하기 없기 그리고 찾아오지 않기.” ‘소희'는 아픈 언니를 대신해 답장을 보내고 두 사람은 편지를 이어나간다. 우연히 시작된 편지는 무채색이던 두 사람의 일상을 설렘과 기다림으로 물들이기 시작하고, ‘영호'는 12월 31일 비가 오면 만나자는 가능성이 낮은 제안을 하게 되는데...",2021/04/28,3634766350,398580,957,0,한국,(주)아지트필름,7.89,5.4,6.73,7.8,0,1556434000,173249,957,15987,1570279000,174796,1169719300,123821,898,14430,2739998300,298617,463459130,48377,633,8832,3203457430,346994,드라마,291,조진모
381,20183084,피터 래빗,"악동토끼 ‘피터 래빗’ VS 깔끔쟁이 ‘토마스’ 이것은 전쟁이다! 영국의 한적한 시골마을에서 마음씨 고운 화가 ‘비’의 사랑을 듬뿍 받으며 행복하게 살고 있던 ‘피터 래빗’과 친구들 그러던 어느 날! 런던에서 온 깔끔쟁이 ‘토마스’가 ‘피터 래빗’이 가장 좋아하는 당근밭 출입을 막아버린다. “이대로 물러 설 순 없다!” ‘피터 래빗’과 친구들은 당근밭에 다시 들어가기 위한 작전을 짜고, ‘토마스’는 토끼들과 평화롭게 지내고 싶어하는 ‘비’의 눈치를 보며 몰래 토끼들을 물리칠 계획을 세우는데… 과연 ‘피터 래빗’과 친구들의 작전은 성공할 수 있을까?",2018/05/16,3006258100,388300,599,0,미국,,9.18,5.5,8.76,7.4,0,868861700,110669,599,3538,882434700,112486,1516439000,197438,595,5080,2398873700,309924,423967100,54713,429,2789,2822840800,364637,애니메이션,0,윌 글럭
382,20191183,제미니 맨,"최강의 요원 헨리(윌 스미스)는 자신과 완벽하게 닮은 의문의 요원(윌 스미스)에게 맹렬한 추격을 당한다. 한편 헨리와 이제 막 동료가 된 대니(메리 엘리자베스 윈스티드), 헨리의 오랜 동료 배런(베네딕트 웡)은 의문의 요원에게 이상한 낌새를 느끼고 정체를 파헤치기 시작하고, 그가 헨리의 DNA를 추출해 탄생한 ‘제미니 프로젝트’ 요원임을 알게 된다. 헨리의 전성기와 너무나 완벽하게 닮은 한 사람을 만나 충격에 빠지는 헨리와 동료들. 그들은 ‘제미니 프로젝트’를 파괴하기 위한 작전을 시작하는데…",2019/10/09,3295969230,387342,845,0,미국,,8.56,5,6.59,6.3,0,2562134400,295689,845,15779,2620238400,302135,588660430,73485,689,9016,3208898830,375620,,,,,,,액션,0,이안
383,20183003,서복,"과거 트라우마를 안겨준 사건으로 인해 외부와 단절된 삶을 살아가고 있는 전직 요원 ‘기헌’은 정보국으로부터 거절할 수 없는 마지막 제안을 받는다. 줄기세포 복제와 유전자 조작을 통해 만들어진 실험체 ‘서복’을 안전하게 이동시키는 일을 맡게 된 것. 하지만 임무 수행과 동시에 예기치 못한 공격을 받게 되고, 가까스로 빠져나온 ‘기헌’과 ‘서복‘은 둘만의 특별한 동행을 시작하게 된다. 실험실 밖 세상을 처음 만나 모든 것이 신기하기만 한 ‘서복‘과 생애 마지막 임무를 서둘러 마무리 짓고 싶은 ‘기헌’은 가는 곳마다 사사건건 부딪친다. 한편, 인류의 구원이자 재앙이 될 수도 있는 ‘서복’을 차지하기 위해 나선 여러 집단의 추적은 점점 거세지고 이들은 결국 피할 수 없는 선택을 하게 되는데…",2021/04/15,3627302450,385284,1382,0,한국,(주)씨제이이엔엠,8.21,5.13,6.33,7.3,0,2013756510,209999,1382,20370,2015645510,210227,1135476200,121151,1180,20832,3151121710,331378,477055740,54031,755,8313,3628177450,385409,드라마,488,이용주
384,20167902,보통사람,"열심히 범인 잡아 국가에 충성하는 강력계 형사이자 사랑하는 아내(라미란), 아들과 함께 2층 양옥집에서 번듯하게 살아보는 것이 소원인 평범한 가장 성진(손현주). 그날도 불철주야 범인 검거에 나섰던 성진은 우연히 검거한 수상한 용의자 태성(조달환)이 대한민국 최초의 연쇄살인범일 수도 있다는 정황을 포착하게 되고, 이로 인해 안기부 실장 규남(장혁)이 주도하는 은밀한 공작에 자신도 모르는 사이 깊숙이 가담하게 된다. 한편, 성진과는 가족과도 같은 막역한 사이인 자유일보 기자 재진(김상호)은 취재 중 이 사건의 수상한 낌새를 눈치채고 성진에게 이쯤에서 손을 떼는 것이 좋겠다고 말하지만, 다리가 불편한 아들의 수술을 약속 받은 성진은 규남의 불편한 제안을 받아들이고 만다. 아버지로서 할 수 밖에 없었던 선택, 이것이 도리어 성진과 가족들을 더욱 위험에 빠트리고 그의 삶을 송두리째 흔들기 시작하는데… 제6회 프랑크푸르트한국영화제 초청 상영 (2017)",2017/03/23,2956397623,383336,621,0,한국,(주)트리니티엔터테인먼트,8.49,5.86,7.96,8.1,0,2012395323,252955,621,9889,2027461323,255227,811882500,111470,567,8101,2839343823,366697,,,,,,,드라마,260,김봉한
