rank,movie_code,movie_name,story,release_time,price,box_off_num,screen,play_num,country,distributor,naver_viewer,naver_reporter,naver_netizen,daum_viewer,high,1주차_매출,1주차_관객수,1주차_스크린수,1주차_상영횟수,1주차_누적매출액,1주차_누적관객수,2주차_매출,2주차_관객수,2주차_스크린수,2주차_상영횟수,2주차_누적매출액,2주차_누적관객수,3주차_매출,3주차_관객수,3주차_스크린수,3주차_상영횟수,3주차_누적매출액,3주차_누적관객수,category,staff,directors
224,20177539,사바하,"한 시골 마을에서 쌍둥이 자매가 태어난다. 온전치 못한 다리로 태어난 ‘금화’(이재인)와 모두가 오래 살지 못할 것이라고 했던 언니 ‘그것’. 하지만 그들은 올해로 16살이 되었다. 신흥 종교 비리를 찾아내는 종교문제연구소 ‘박목사’(이정재)는 사슴동산이라는 새로운 종교 단체를 조사 중이다. 영월 터널에서 여중생이 사체로 발견되는 사건이 발생하고 이를 쫓던 경찰과 우연히 사슴동산에서 마주친 박목사는 이번 건이 심상치 않음을 직감한다. 하지만 진실이 밝혀지기 전 터널 사건의 용의자는 자살하고, 그가 죽기 전 마지막으로 만난 실체를 알 수 없는 정비공 ‘나한’(박정민)과 16년 전 태어난 쌍둥이 동생 금화의 존재까지 사슴동산에 대해 파고들수록 박목사는 점점 더 많은 미스터리와 마주하게 되는데…! 그것이 태어나고 모든 사건이 시작되었다",2019/02/20,20002183194,2397792,1174,0,한국,(주)외유내강,7.42,6.89,7.34,7.3,0,9977756613,1174016,1174,28670,9995969613,1176175,7860039521,972326,1103,29405,17856009134,2148501,1664306930,192024,833,13459,19520316064,2340525,미스터리,580,장재현
225,20178982,박열,"1923년, 관동대지진 이후 퍼진 괴소문으로 6천여 명의 무고한 조선인이 학살된다. 사건을 은폐하기 위해, 관심을 돌릴 화젯거리가 필요했던 일본내각은 '불령사'를 조직해 항일운동을 하던 조선 청년 '박열'을 대역사건의 배후로 지목한다. ""그들이 원하는 영웅이 돼줘야지"" 일본의 계략을 눈치챈 '박열'은 동지이자 연인인 가네코 후미코와 함께 일본 황태자 폭탄 암살 계획을 자백하고, 사형까지 무릅쓴 역사적인 재판을 시작하는데.... 조선인 최초의 대역죄인! 말 안 듣는 조선인 중 가장 말 안 듣는 조선인! 역사상 가장 버릇없는 피고인! 일본 열도를 발칵 뒤집은 사상 초유의 스캔들! 그 중심에 '박열'이 있었다!",2017/06/28,18093543795,2359174,1176,0,한국,(유)박열문화전문회사,8.48,6.7,8.12,8,0,8990218470,1164624,1176,25212,9118256970,1180561,5097909426,661679,1102,25960,14216166396,1842240,2814196199,369975,710,16781,17030362595,2212215,드라마,340,이준익
226,20205041,분노의 질주: 더 얼티메이트,"도미닉(빈 디젤)은 자신과 가장 가까웠던 형제 제이콥(존 시나)이 사이퍼(샤를리즈 테론)와 연합해 전 세계를 위기로 빠트릴 위험천만한 계획을 세운다는 사실을 알게 되고, 이를 막기 위해 다시 한 번 패밀리들을 소환한다. 가장 가까운 자가 한순간, 가장 위험한 적이 된 상황 도미닉과 패밀리들은 이에 반격할 놀라운 컴백과 작전을 세우고 지상도, 상공도, 국경도 경계가 없는 불가능한 대결이 시작되는데…",2021/05/19,22059658060,2292415,2297,0,미국,,8.8,5.71,7.36,6,0,11096477100,1133201,2297,41209,11096477100,1133201,5812831500,617234,2049,38547,16909308600,1750435,2858222840,300164,1332,25972,19767531440,2050599,액션,0,저스틴 린
227,20181942,맘마미아!2,"“인생은 짧고 세상은 넓어. 멋진 추억을 만들고 싶어!” 엄마 도나(메릴 스트립)의 모든 것이 담긴 호텔 재개장을 준비하며 홀로서기를 결심한 소피. 그녀는 엄마의 영원한 친구 타냐와 로지, 그리고 사랑스러운 세 아빠들 샘, 해리, 빌에게 리오픈 파티 초대장을 보낸다. 한편 소피는 파티 준비 중 엄마의 숨겨진 찬란했던 추억과 비밀을 들여다보게 되고, 뜻밖의 손님까지 방문하는데… 과연 한여름의 파티는 무사히 열릴 수 있을까? “엄마가 자랑스러워할 인생 최고의 파티를 열게요!”",2018/08/08,19532365003,2285143,750,0,미국,,9.08,6.2,8.97,7.8,0,6759402188,786242,750,14320,7432720988,861456,6210467697,720754,704,13700,13643188685,1582210,3221927700,374831,631,11299,16865116385,1957041,뮤지컬,3,올 파커
228,20171122,레디 플레이어 원,"2045년, 암울한 현실과 달리 가상현실 오아시스(OASIS)에서는 누구든 원하는 캐릭터로 어디든지 갈 수 있고, 뭐든지 할 수 있고 상상하는 모든 게 가능하다. 웨이드 와츠(타이 쉐리던) 역시 유일한 낙은 대부분의 사람들이 하루를 보내는 오아시스에 접속하는 것이다. 어느 날 오아시스의 창시자인 괴짜 천재 제임스 할리데이(마크 라이런스)는 자신이 가상현실 속에 숨겨둔 3개의 미션에서 우승하는 사람에게 오아시스의 소유권과 막대한 유산을 상속한다는 유언을 남기고, 그가 사랑했던 80년대 대중문화 속에 힌트가 있음을 알린다. 제임스 할리데이를 선망했던 소년 ‘웨이드 와츠’가 첫 번째 수수께끼를 푸는 데 성공하자 이를 저지하기 위해 현실에서 살인도 마다하지 않는 ‘IOI’라는 거대 기업이 뛰어든다. 모두의 꿈과 희망이 되는 오아시스를 지키기 위해서는 반드시 우승해야 한다! 그리고 우승을 위해서는 가상현실이 아닌 현실세계의 우정과 사랑의 힘이 필요하기만 한데…",2018/03/28,19933108071,2254430,1079,0,미국,,8.72,8.36,8.53,7.9,0,8508241079,984512,1079,21358,8536657079,986709,6614881934,739353,982,25941,15151539013,1726062,3021056258,340040,786,16909,18172595271,2066102,액션,0,스티븐 스필버그
229,20196270,싱크홀,"서울 입성과 함께 내 집 마련의 꿈을 이룬 가장 ‘동원(김성균)’ 이사 첫날부터 프로 참견러 ‘만수’(차승원)와 사사건건 부딪힌다. ‘동원’은 자가취득을 기념하며 직장 동료들을 집들이에 초대하지만 행복한 단꿈도 잠시, 순식간에 빌라 전체가 땅 속으로 떨어지고 만다. 마주치기만 하면 투닥거리는 빌라 주민 ‘만수’와 ‘동원’ ‘동원’의 집들이에 왔던 ‘김대리’(이광수)와 인턴사원 ‘은주’(김혜준)까지! 지하 500m 싱크홀 속으로 떨어진 이들은 과연 무사히 빠져나갈 수 있을까? “한 500m 정도는 떨어진 것 같아” “우리… 나갈 수 있을까요?”",2021/08/11,21395652690,2195683,1603,0,한국,(주)더타워픽쳐스,7.01,5.17,6.36,6.7,0,9066644210,920221,1603,32573,9086168210,922343,7220288220,735617,1584,36886,16306456430,1657960,3082094760,324556,1170,26784,19388551190,1982516,코미디,498,김지훈
230,20181434,신의 한 수: 귀수편,바둑으로 모든 것을 잃은 아이 ‘귀수’ 유일하게 기대던 스승 허일도마저 잃고 홀로 살아남아 세상을 향한 복수를 계획한다. 운명의 선택은 神의 놀음판에 있다! 자신을 사지로 내몬 냉혹한 내기바둑판으로 뛰어든 귀수(권상우)는 전국을 돌아다니며 귀신 같이 바둑을 두는 자들과 대결을 펼치는데… 사활을 건 대결! 신의 한 수를 다시 두시겠습니까?,2019/11/07,18390955050,2146764,1246,0,한국,(주)메이스엔터테인먼트,8.69,5,7.78,6.8,0,9282779720,1060292,1246,24866,9355600720,1070965,6511919290,767600,1185,34534,15867520010,1838565,2052139580,246602,960,18035,17919659590,2085167,범죄,431,리건
231,20218052,베놈 2: 렛 데어 비 카니지,"‘베놈’과 완벽한 파트너가 된 ‘에디 브록’(톰 하디) 앞에 ‘클리터스 캐서디’(우디 해럴슨)가 ‘카니지’로 등장, 앞으로 닥칠 대혼돈의 세상을 예고한다. 대혼돈의 시대가 시작되고, 악을 악으로 처단할 것인가?",2021/10/13,21115762990,2123573,1998,0,미국,,6.4,5.5,6.07,5.3,0,10961750170,1095689,1998,48414,10974860170,1096563,5506233320,552726,1774,47022,16481093490,1649289,3111003020,325444,1347,36142,19592096510,1974733,액션,0,앤디 서키스
232,20172204,명당,"땅의 기운을 점쳐 인간의 운명을 바꿀 수 있는 천재지관 박재상(조승우)은 명당을 이용해 나라를 지배하려는 장동 김씨 가문의 계획을 막다 가족을 잃게 된다. 13년 후, 복수를 꿈꾸는 박재상 앞에 세상을 뒤집고 싶은 몰락한 왕족 흥선(지성)이 나타나 함께 장동 김씨 세력을 몰아낼 것을 제안한다. 뜻을 함께하여 김좌근 부자에게 접근한 박재상과 흥선은 두 명의 왕이 나올 천하명당의 존재를 알게 되고, 서로 다른 뜻을 품게 되는데…",2018/09/19,17900775524,2087474,1117,0,한국,(주)주피터필름,7.75,5.8,7.06,6.7,0,6585883109,752243,1117,22643,6647584109,759842,10357944765,1211362,1039,26307,17005528874,1971204,751668000,95261,793,8420,17757196874,2066465,사극,441,박희곤
233,20207443,소울,"뉴욕에서 음악 선생님으로 일하던 ‘조’는 꿈에 그리던 최고의 밴드와 재즈 클럽에서 연주하게 된 그 날, 예기치 못한 사고로 영혼이 되어 ‘태어나기 전 세상’에 떨어진다. 탄생 전 영혼들이 멘토와 함께 자신의 관심사를 발견하면 지구 통행증을 발급하는 ‘태어나기 전 세상’ ‘조’는 그 곳에서 유일하게 지구에 가고 싶어하지 않는 시니컬한 영혼 ‘22’의 멘토가 된다. 링컨, 간디, 테레사 수녀도 멘토되길 포기한 영혼 ‘22’ 꿈의 무대에 서려면 ‘22’의 지구 통행증이 필요한 ‘조’ 그는 다시 지구로 돌아가 꿈의 무대에 설 수 있을까?",2021/01/20,19034164180,2048137,2018,0,미국,,9.32,8.44,9.31,8.7,0,3757665500,407476,2018,28397,3766703500,408482,4169603410,466517,1709,34803,7936306910,874999,3137598360,331819,1439,27284,11073905270,1206818,애니메이션,0,피트 닥터
234,20184571,천문: 하늘에 묻는다,역사상 가장 위대한 왕 세종 관노로 태어나 종3품 대호군이 된 천재 과학자 장영실 20년간 꿈을 함께하며 위대한 업적을 이뤄낸 두 사람이었지만 임금이 타는 가마 안여(安與)가 부서지는 사건으로 세종은 장영실을 문책하며 하루아침에 궁 밖으로 내치고 그 이후 장영실은 자취를 감추는데... 조선의 시간과 하늘을 만들고자 했던 세종과 장영실! 그들의 숨겨진 이야기가 밝혀진다!,2019/12/26,16502543020,2000490,1198,0,한국,(주)하이브미디어코프,8.8,6.7,8.81,8.3,0,5645802770,688698,1198,17646,5724727770,702245,7648894610,909154,1103,25374,13373622380,1611399,2251790090,274974,873,16288,15625412470,1886373,사극,716,허진호
235,20201122,테넷,시간의 흐름을 뒤집는 인버전을 통해 현재와 미래를 오가며 세상을 파괴하려는 사토르(케네스 브래너)를 막기 위해 투입된 작전의 주도자(존 데이비드 워싱턴). 인버전에 대한 정보를 가진 닐(로버트 패틴슨)과 미술품 감정사이자 사토르에 대한 복수심이 가득한 그의 아내 캣(엘리자베스 데비키)과 협력해 미래의 공격에 맞서 제3차 세계대전을 막아야 한다!,2020/08/26,18464298170,1998987,2228,0,미국,,8.76,7.18,8.15,6.8,0,5166552000,575699,2228,43086,6018063040,660405,3682832820,399392,2050,36255,9700895860,1059797,2572497990,275427,1470,26278,12273393850,1335224,액션,0,크리스토퍼 놀란
236,20216362,크루엘라,"처음부터 난 알았어. 내가 특별하단 걸 그게 불편한 인간들도 있겠지만 모두의 비위를 맞출 수는 없잖아? 그러다 보니 결국, 학교를 계속 다닐 수가 없었지 우여곡절 런던에 오게 된 나, 에스텔라는 재스퍼와 호레이스를 운명처럼 만났고 나의 뛰어난 패션 감각을 이용해 완벽한 변장과 빠른 손놀림으로 런던 거리를 싹쓸이 했어 도둑질이 지겹게 느껴질 때쯤, 꿈에 그리던 리버티 백화점에 낙하산(?)으로 들어가게 됐어 거리를 떠돌았지만 패션을 향한 나의 열정만큼은 언제나 진심이었거든 근데 이게 뭐야, 옷에는 손도 못 대보고 하루 종일 바닥 청소라니 인내심에 한계를 느끼고 있을 때, 런던 패션계를 꽉 쥐고 있는 남작 부인이 나타났어 천재는 천재를 알아보는 법! 난 남작 부인의 브랜드 디자이너로 들어가게 되었지 꿈을 이룰 것 같았던 순간도 잠시, 세상에 남작 부인이 ‘그런 사람’이었을 줄이야… 그래서 난 내가 누군지 보여주기로 했어 잘가, 에스텔라 난 이제 크루엘라야!",2021/05/26,19252879640,1983397,1184,0,미국,,9.23,6.63,9.2,8.6,0,2739238680,297400,1184,15999,2749984680,298576,3558458870,365801,1186,22837,6308443550,664377,2947042440,301465,1060,20167,9255485990,965842,드라마,0,크레이그 질레스피
237,20177308,협상,"어떠한 상황에서도 냉철함을 잃지 않던 최고의 협상가 ‘하채윤’은 긴급 투입된 현장에서 인질과 인질범 모두 사망하는 사건을 겪고 충격에 휩싸인다. 그로부터 10일 후, 경찰청 블랙리스트에 오른 국제 범죄조직의 무기 밀매업자 ‘민태구’가 태국에서 한국 경찰과 기자를 납치하고 그녀를 협상 대상으로 지목한다. 이유도 목적도 조건도 없이 사상 최악의 인질극을 벌이는 ‘민태구’와 그를 멈추기 위해 한치도 물러설 수 없는 협상가 ‘하채윤’ 남은 시간 12시간, 목숨을 건 일생일대의 협상이 시작된다!",2018/09/19,17032133166,1967721,919,0,한국,(주)제이케이필름,8.16,5.43,7.32,7,0,5345844759,607063,898,18824,5446677759,618547,9759694357,1125395,919,24571,15206372116,1743942,1583542400,187992,867,12066,16789914516,1931934,범죄,580,이종석
238,20188282,알리타: 배틀 엔젤,"모두가 갈망하는 공중도시와 그들을 위해 존재하는 고철도시로 나누어진 26세기.
고철 더미 속 모든 기억을 잃은 채 깨어난 알리타는 마음 따뜻한 의사 이도의 보살핌으로 새로운 삶을 시작한다. 이도는 사이보그인 알리타에게 특별한 과거의 비밀과 영혼이 존재한다는 사실을 깨닫고 미스터리한 과거로부터 그녀를 지키고자 한다. 한편, 새로운 친구 휴고는 알리타가 위험한 고철도시를 헤쳐나갈 수 있는 방법과 함께 기억을 되찾도록 돕는다. 알리타가 자신의 과거에 다가 갈수록 도시를 지배하는 악랄한 세력들이 그녀를 노리며 제거하려고 하고 자신이 착취와 약탈의 고철도시를 구할 수 있는 열쇠임을 깨닫게 된 알리타는 사랑하는 가족과 친구, 새로운 세상을 위해 통제된 세상의 무시무시한 적들과 맞서게 되는데…",2019/02/05,18527661667,1949372,1043,0,미국,,8.82,7.14,8.7,8.3,0,12014344079,1244171,1043,23349,12197999079,1256871,4342800375,461147,966,18228,16540799454,1718018,1494476643,167328,637,7669,18035276097,1885346,액션,1,로버트 로드리게즈
239,20193069,#살아있다,"원인불명 증세의 사람들의 공격에 통제 불능에 빠진 도시. 영문도 모른 채 잠에서 깬 ‘준우’(유아인)는 아무도 없는 집에 혼자 고립된 것을 알게 된다. 데이터, 와이파이, 문자, 전화 모든 것이 끊긴 채 고립된 상황. 연락이 두절된 가족에 이어 최소한의 식량마저 바닥이 나자 더 이상 버티기 힘들어진 ‘준우’. 하지만 그 순간 건너편 아파트에서 누군가 시그널을 보내온다. 또 다른 생존자 ‘유빈’(박신혜)이 아직 살아있음을 알게 된 ‘준우’는 함께 살아남기 위한 방법을 찾아 나서는데...! 꼭 살아남아야 한다",2020/06/24,15965329900,1903703,1882,0,한국,영화사 집,7.02,5.57,4.12,4.6,0,8842177340,1057234,1882,40643,8855344340,1060001,4201800600,486928,1644,46505,13057144940,1546929,2056292360,235999,1329,30744,15113437300,1782928,드라마,556,조일형
240,20176251,내안의 그놈,"엘리트 아재 판수(박성웅)를 우연히 옥상에서 떨어진 고등학생 동현(진영)이 덮치면서 제대로 바뀐다. 게다가 판수는 동현의 몸으로 첫사랑 미선(라미란)과 존재도 몰랐던 딸 현정(이수민)을 만나게 되는데… 대유잼의 향연, 넌 이미 웃고 있다!",2019/01/09,16293580567,1901684,1041,0,한국,(주)에코필름,8.76,4,8.18,7.9,0,6476557476,744986,1041,15889,6638682476,765380,7142011621,831673,1004,25133,13780694097,1597053,2279443940,274071,913,16625,16060138037,1871124,판타지,250,강효진
241,20174602,노무현입니다,"국회의원, 시장 선거 등 출마하는 선거마다 번번이 낙선했던 만년 꼴찌 후보 노무현이 2002년 대선 당시 대한민국 정당 최초로 도입된 새천년민주당 국민참여경선에 당당히 출사표를 던진다. 제주를 시작으로 전국 16개 도시에서 치러진 대국민 이벤트. 쟁쟁한 후보들과 엎치락뒤치락하며 제주 경선 3위, 울산 1위, 그리고 광주까지 석권한 지지율 2%의 꼴찌 후보 노무현이 전국을 뒤흔들기 시작한다.",2017/05/25,14554935612,1854867,775,0,한국,영화사 풀,9.49,6.67,8.92,9.5,0,4892027812,594789,775,12879,4904035812,596691,4413093100,580058,710,18243,9317128912,1176749,3058198100,391073,593,11833,12375327012,1567822,다큐멘터리,74,이창재
242,20180868,뺑반,"경찰 내 최고 엘리트 조직 내사과 소속 경위 ‘은시연’(공효진). 조직에서 유일하게 믿고 따르는 ‘윤과장’(염정아)과 함께 F1 레이서 출신의 사업가 ‘정재철’(조정석)을 잡기 위해 수사망을 조여가던 시연은 무리한 강압 수사를 벌였다는 오명을 쓰고 뺑소니 전담반으로 좌천된다. 알고 보면 경찰대 수석 출신, 만삭의 리더 ‘우계장’(전혜진)과 차에 대한 천부적 감각을 지닌 에이스 순경 ‘서민재’(류준열). 팀원은 고작 단 두 명, 매뉴얼도 인력도 시간도 없지만 뺑소니 잡는 실력만큼은 최고인 ‘뺑반’. 계속해서 재철을 예의주시하던 시연은 뺑반이 수사 중인 미해결 뺑소니 사건의 유력한 용의자가 재철임을 알게 된다. 뺑소니 친 놈은 끝까지 쫓는 뺑반 에이스 민재와 온갖 비리를 일삼는 재철을 잡기 위해 모든 것을 건 시연. 하나의 목표를 향해 힘을 합친 그들의 팀플레이가 시작되는 가운데 방법을 가리지 않고 수사망을 빠져 나가려는 통제불능 스피드광 재철의 반격 역시 점점 과감해지는데…!",2019/01/30,15222811848,1826714,1285,0,한국,호두앤유픽쳐스(주),7.15,5.25,5.98,6.3,0,7600873047,954106,1285,22795,7686309147,963002,6777145131,769192,996,17510,14463454278,1732194,715718430,88953,714,6297,15179172708,1821147,범죄,540,한준희
243,20184543,변신,사람의 모습으로 변신하는 악마가 우리 가족 안에 숨어들면서 기이하고 섬뜩한 사건들이 벌어진다 서로 의심하고 증오하고 분노하는 가운데 구마 사제인 삼촌 '중수'가 예고없이 찾아오는데… 절대 믿지도 듣지도 마라,2019/08/21,15417922925,1804112,975,0,한국,(주)다나크리에이티브,7.89,4.5,6.73,7.3,0,6720691442,754709,975,16362,6846946442,768998,5999181420,730362,934,23271,12846127862,1499360,2199261533,258319,804,18310,15045389395,1757679,공포,427,김홍선
244,20196271,강철비2: 정상회담,"북미 평화협정 체결을 위한 대한민국 대통령(정우성), 북한의 최고지도자인 위원장(유연석)과 미국 대통령(앵거스 맥페이든)간의 남북미 정상회담이 북한 원산에서 열린다. 북미 사이 좀처럼 이견이 좁혀지지 않는 가운데, 핵무기 포기와 평화체제 수립에 반발하는 북 호위총국장(곽도원)의 쿠데타가 발생하고, 납치된 세 정상은 북한 핵잠수함에 인질로 갇힌다. 그리고, 좁디 좁은 함장실 안, 예기치 못한 진정한 정상회담이 벌어지게 되는데… 동북아시아의 운명이 핵잠수함에 갇혔다! 과연, 남북미 세 지도자는 전쟁 위기를 막을 수 있을 것인가?",2020/07/29,14655366110,1790797,2137,0,한국,(주)스튜디오게니우스우정,7.96,6.64,4.98,7.9,0,8362654560,1016243,2137,46840,8390205560,1019937,4329832830,522023,1952,35204,12720038390,1541960,1424538670,179644,969,14590,14144577060,1721604,드라마,538,양우석
245,20217742,샹치와 텐 링즈의 전설,"초인적인 능력을 가진 ‘텐 링즈’의 힘으로 수세기 동안 어둠의 세상을 지배해 온 ‘웬우’ '샹치’는 아버지 ‘웬우’ 밑에서 암살자로 훈련을 받았지만 이를 거부하고 평범함 삶을 선택한다. 그러나 ‘샹치’는 목숨을 노리는 자들의 습격으로 더 이상 운명을 피할 수 없다는 것을 직감하고, 어머니가 남긴 가족의 비밀과 내면의 신비한 힘을 일깨우게 된다 벗어나고 싶은 과거이자, 그 누구보다 두려운 아버지 ‘웬우’를 마주해야 하는 ‘샹치’ 악이 될 것인가? 구원이 될 것인가? 마블의 새로운 시대, 세상에 없던 힘이 탄생한다!",2021/09/01,17691789720,1739052,1784,0,미국,,7.41,6.63,6.32,5.1,0,7651117390,753729,1784,32168,7667474390,755058,4811929970,471573,1652,39376,12479404360,1226631,2168343960,213395,1451,19000,14647748320,1440026,액션,0,데스틴 다니엘 크리튼
246,20171962,킬러의 보디가드,"미치광이 킬러 ‘다리우스’의 경호를 맡은 후 매일 밤 그의 악몽을 꾸는 보디가드 ‘마이클’ 앞에 나타난 무대포 직진녀 ‘소니아’ 남편 ‘다리우스’가 납치되었다며 다짜고짜 그를 구하러 가야 한다고 하는데… 한 명도 버거운데 그의 와이프까지 플러스?! 설상가상으로 유럽 전역을 위기로 몰아넣는 사건들이 연속적으로 터지고 인터폴의 비밀스러운 의뢰까지 추가되는데.. 2배 더 강력한, 2배 더 골때리는, 2배 더 커진 모두가 기다린 1+1 트리플 환장 액션 블록버스터가 온다!",2017/08/30,14020395800,1721757,482,0,미국,,9.1,5.6,8.4,7.3,0,6236331600,760861,482,10208,6379263900,776937,4159149200,496490,424,12480,10538413100,1273427,1861187100,222971,334,8576,12399600200,1496398,액션,0,패트릭 휴즈
247,20199816,담보,"1993년 인천 거칠고 까칠한 사채업자 두석(성동일)과 종배(김희원)는 떼인 돈 받으러 갔다가 얼떨결에 9살 승이(박소이)를 담보로 맡게 된다. “담보가 무슨 뜻이에요?” 뜻도 모른 채 담보가 된 승이와 승이 엄마의 사정으로 아이의 입양까지 책임지게 된 두석과 종배. 하지만 부잣집으로 간 줄 알았던 승이가 엉뚱한 곳에 있다는 것을 알게 된 두 사람은 승이를 데려와 돌보게 된다. 예고 없이 찾아온 아이에게 인생을 담보 잡힌 두석과 종배. 빚 때문에 아저씨들에게 맡겨진 담보 승이. 두석, 종배, 승이 세 사람은 어느덧 서로에게 특별한 존재가 되는데.. 돈 받으러 갔다가 인생의 보물을 만났다!",2020/09/29,14749476550,1719592,1342,0,한국,(주)제이케이필름,9.18,5.2,8.96,8.5,0,7088485600,820932,1342,29740,7093228600,821459,3649855650,419845,1219,29193,10743084250,1241304,1791242480,207482,1073,22731,12534326730,1448786,드라마,341,강대규
248,20170658,PMC: 더 벙커,"글로벌 군사기업(PMC) 블랙리저드의 캡틴 에이헵(하정우)은 미국 CIA의 의뢰로 거액의 프로젝트를 맡게 된다. 그러나 작전장소인 DMZ 지하 30M 비밀벙커에는 약속된 타깃이 아닌 뜻밖의 인물, 북한 ‘킹’이 나타난다. 아시아 최고의 현상금이 걸린 킹, 그를 잡기 위해 캡틴 에이헵은 작전을 변경하고, 12인의 크루들과 함께 킹을 납치하는 데 성공한다. 하지만 또 다른 군사기업(PMC)의 기습과 미국 CIA의 폭격으로 함정에 빠져버린 에이헵과 블랙리저드팀. 결국 무너져버린 지하 비밀 벙커 안 부상을 입은 에이헵은 인질로 잡혀 있던 북한 최고의 엘리트 닥터 윤지의에게 도움을 요청하는데… 현 시각부로 작전 변경! 생존을 위한 리얼타임 액션이 시작된다!",2018/12/26,14024838424,1671548,1081,0,한국,(주)퍼펙트스톰필름,6.53,6.9,5.19,5.3,0,8186763417,991869,1081,22425,8365701917,1013905,5122542977,593770,957,20588,13488244894,1607675,488207980,57525,670,5991,13976452874,1665200,액션,570,김병우
249,20192194,인질,"평소와 똑같던 어느 새벽, 서울 한복판에서 증거도, 목격자도 없이 대한민국 톱배우 '황정민'이 납치된다. 한 치 앞을 알 수 없는 상황 속 살기 위한 극한의 탈주가 시작되는데… 관객들을 사로잡을 리얼리티 액션스릴러가 온다!",2021/08/18,15585244870,1638439,1288,0,한국,(주)외유내강,7.14,6,6.53,5.2,0,6277820320,631872,1288,26480,6348786620,638885,4808219870,501044,1294,33882,11157006490,1139929,2408029840,258754,1164,21941,13565036330,1398683,액션,405,필감성
