rank,movie_code,movie_name,story,release_time,price,box_off_num,screen,play_num,country,distributor,naver_viewer,naver_reporter,naver_netizen,daum_viewer,high,1주차_매출,1주차_관객수,1주차_스크린수,1주차_상영횟수,1주차_누적매출액,1주차_누적관객수,2주차_매출,2주차_관객수,2주차_스크린수,2주차_상영횟수,2주차_누적매출액,2주차_누적관객수,3주차_매출,3주차_관객수,3주차_스크린수,3주차_상영횟수,3주차_누적매출액,3주차_누적관객수,category,staff,directors
1,20129370,명량,"1597년 임진왜란 6년, 오랜 전쟁으로 인해 혼란이 극에 달한 조선. 무서운 속도로 한양으로 북상하는 왜군에 의해 국가존망의 위기에 처하자 누명을 쓰고 파면 당했던 이순신 장군(최민식)이 삼도수군통제사로 재임명된다. 하지만 그에게 남은 건 전의를 상실한 병사와 두려움에 가득 찬 백성, 그리고 12척의 배 뿐. 마지막 희망이었던 거북선마저 불타고 잔혹한 성격과 뛰어난 지략을 지닌 용병 구루지마(류승룡)가 왜군 수장으로 나서자 조선은 더욱 술렁인다. 330척에 달하는 왜군의 배가 속속 집결하고 압도적인 수의 열세에 모두가 패배를 직감하는 순간, 이순신 장군은 단 12척의 배를 이끌고 명량 바다를 향해 나서는데…! 12척의 조선 vs 330척의 왜군 역사를 바꾼 위대한 전쟁이 시작된다!",2014/07/30,135757000000,17615686,1587,188720,한국,(주)씨제이이엔엠,8.8,6.29,8.44,7.8,1,36801884916,4755139,1587,34724,36900683916,4767617,46610791175,6038438,1507,50640,83511475091,10806055,29610126519,3831181,1224,39772,113122000000,14637236,사극,546,김한민
2,20182530,극한직업,"불철주야 달리고 구르지만 실적은 바닥, 급기야 해체 위기를 맞는 마약반! 더 이상 물러설 곳이 없는 팀의 맏형 고반장은 국제 범죄조직의 국내 마약 밀반입 정황을 포착하고 장형사, 마형사, 영호, 재훈까지 4명의 팀원들과 함께 잠복 수사에 나선다. 마약반은 24시간 감시를 위해 범죄조직의 아지트 앞 치킨집을 인수해 위장 창업을 하게 되고, 뜻밖의 절대미각을 지닌 마형사의 숨은 재능으로 치킨집은 일약 맛집으로 입소문이 나기 시작한다. 수사는 뒷전, 치킨장사로 눈코 뜰 새 없이 바빠진 마약반에게 어느 날 절호의 기회가 찾아오는데… 범인을 잡을 것인가, 닭을 잡을 것인가!",2019/01/23,139656000000,16266338,2003,292816,한국,(주)씨제이이엔엠,9.2,6.8,8.51,7.4,1,27359558550,3120405,1978,47854,27528787550,3139563,34630842393,4154994,1949,65095,62159629943,7294557,49191480029,5544306,2003,67240,111351000000,12838863,코미디,518,이병헌
3,20150976,신과함께-죄와 벌,"저승 법에 의하면, 모든 인간은 사후 49일 동안 7번의 재판을 거쳐야만 한다. 살인, 나태, 거짓, 불의, 배신, 폭력, 천륜 7개의 지옥에서 7번의 재판을 무사히 통과한 망자만이 환생하여 새로운 삶을 시작할 수 있다. “김자홍 씨께선, 오늘 예정 대로 무사히 사망하셨습니다” 화재 사고 현장에서 여자아이를 구하고 죽음을 맞이한 소방관 자홍, 그의 앞에 저승차사 해원맥과 덕춘이 나타난다. 자신의 죽음이 아직 믿기지도 않는데 덕춘은 정의로운 망자이자 귀인이라며 그를 치켜세운다. 저승으로 가는 입구, 초군문에서 그를 기다리는 또 한 명의 차사 강림, 그는 차사들의 리더이자 앞으로 자홍이 겪어야 할 7개의 재판에서 변호를 맡아줄 변호사이기도 하다. 염라대왕에게 천년 동안 49명의 망자를 환생시키면 자신들 역시 인간으로 환생시켜 주겠다는 약속을 받은 삼차사들, 그들은 자신들이 변호하고 호위해야 하는 48번째 망자이자 19년 만에 나타난 의로운 귀인 자홍의 환생을 확신하지만, 각 지옥에서 자홍의 과거가 하나 둘씩 드러나면서 예상치 못한 고난과 맞닥뜨리는데… 누구나 가지만 아무도 본 적 없는 곳, 새로운 세계의 문이 열린다!",2017/12/20,115728000000,14414658,1912,214631,한국,롯데엔터테인먼트,8.73,5.92,7.83,7.1,1,28688193269,3548260,1887,38478,28770391469,3558732,39580104963,4980763,1912,52781,68350496432,8539495,24221083905,2962764,1644,42722,92571580337,11502259,판타지,787,김용화
4,20137048,국제시장,"1950년대 한국전쟁 이후로부터 현재에 이르기까지 격변의 시대를 관통하며 살아온 우리 시대 아버지 ‘덕수’(황정민 분), 그는 하고 싶은 것도 되고 싶은 것도 많았지만 평생 단 한번도 자신을 위해 살아본 적이 없다. ‘괜찮다’ 웃어 보이고 ‘다행이다’ 눈물 훔치며 힘들었던 그때 그 시절, 오직 가족을 위해 굳세게 살아온 우리들의 아버지 이야기가 지금부터 시작된다.",2014/12/17,110945000000,14263980,1044,212696,한국,(주)씨제이이엔엠,9.16,5.81,9.02,7.1,1,11920715644,1528813,966,23042,12120015644,1555055,21302114252,2726548,960,27887,33422129896,4281603,27120029765,3471300,1044,31586,60542159661,7752903,드라마,548,윤제균
5,20184889,어벤져스: 엔드게임,인피니티 워 이후 절반만 살아남은 지구 마지막 희망이 된 어벤져스 먼저 떠난 그들을 위해 모든 것을 걸었다! 위대한 어벤져스 운명을 바꿀 최후의 전쟁이 펼쳐진다!,2019/04/24,122492000000,13977602,2835,246433,미국,월트디즈니컴퍼니코리아,9.5,7.62,9.38,7.9,1,54355659450,6308048,2835,64165,54355659450,6308048,40673241700,4644267,2802,78887,95028901150,10952315,16739625580,1847217,2384,53735,111769000000,12799532,액션,0,안소니 루소
6,20197803,겨울왕국 2,"어느 날 부턴가 의문의 목소리가 엘사를 부르고, 평화로운 아렌델 왕국을 위협한다. 트롤은 모든 것은 과거에서 시작되었음을 알려주며 엘사의 힘의 비밀과 진실을 찾아 떠나야한다고 조언한다. 위험에 빠진 아렌델 왕국을 구해야만 하는 엘사와 안나는 숨겨진 과거의 진실을 찾아 크리스토프, 올라프 그리고 스벤과 함께 위험천만한 놀라운 모험을 떠나게 된다. 자신의 힘을 두려워했던 엘사는 이제 이 모험을 헤쳐나가기에 자신의 힘이 충분하다고 믿어야만 하는데… 두려움을 깨고 새로운 운명을 만나다!",2019/11/21,114810000000,13747792,2648,299334,미국,월트디즈니컴퍼니코리아,8.95,6.75,8.7,7.3,1,38024959800,4437734,2648,58621,38024959800,4437734,33653472160,4145740,2368,83423,71678431960,8583474,17704015160,2114627,1914,58686,89382447120,10698101,애니메이션,1,크리스 벅
7,20148048,베테랑,"한 번 꽂힌 것은 무조건 끝을 보는 행동파 ‘서도철’(황정민), 20년 경력의 승부사 ‘오팀장’(오달수), 위장 전문 홍일점 ‘미스봉’(장윤주), 육체파 ‘왕형사’(오대환), 막내 ‘윤형사’(김시후)까지 겁 없고, 못 잡는 것 없고, 봐 주는 것 없는 특수 강력사건 담당 광역수사대. 오랫동안 쫓던 대형 범죄를 해결한 후 숨을 돌리려는 찰나, 서도철은 재벌 3세 ‘조태오’(유아인)를 만나게 된다. 세상 무서울 것 없는 안하무인의 조태오와 언제나 그의 곁을 지키는 오른팔 ‘최상무’(유해진). 서도철은 의문의 사건을 쫓던 중 그들이 사건의 배후에 있음을 직감한다. 건들면 다친다는 충고에도 불구하고 포기하지 않는 서도철의 집념에 판은 걷잡을 수 없이 커져가고 조태오는 이를 비웃기라도 하듯 유유히 포위망을 빠져 나가는데… 베테랑 광역수사대 VS 유아독존 재벌 3세 2015년 여름, 자존심을 건 한판 대결이 시작된다!",2015/08/05,105171000000,13414484,1115,199307,한국,(주)씨제이이엔엠,9.24,7.5,9.01,8.4,1,21635866923,2742795,1064,25920,21781265923,2761634,30405867542,3882104,1115,37090,52187133465,6643738,18893763856,2400249,983,33066,71080897321,9043987,액션,402,류승완
8,20090834,아바타,"지구 에너지 고갈 문제를 해결하기 위해 판도라 행성으로 향한 인류는 원주민 ‘나비족’과 대립하게 된다. 이 과정에서, 전직 해병대원 제이크 설리(샘 워싱턴)가 ‘아바타’ 프로그램을 통해 ‘나비족’의 중심부에 투입되는데… 피할 수 없는 전쟁! 이 모든 운명을 손에 쥔 제이크! 그 누구도 넘보지 못한 역대급 세계가 열린다! 아바타: 인간과 ‘나비족’의 DNA를 결합해 만들어졌으며 링크룸을 통해 인간의 의식으로 원격 조종할 수 있는 새로운 생명체",2009/12/17,125304000000,13338863,917,164457,미국,"주식회사 해리슨앤컴퍼니,이십세기폭스코리아㈜",,8.83,9.07,9,1,13723788000,1666695,917,15743,13732288000,1667545,21316631000,2545075,736,22855,35048919000,4212620,21177458000,2427272,714,22126,56226377000,6639892,SF,1,제임스 카메론
9,20124034,도둑들,"한 팀으로 활동 중인 한국의 도둑 뽀빠이와 예니콜, 씹던껌, 잠파노. 미술관을 터는데 멋지게 성공한 이들은 뽀빠이의 과거 파트너였던 마카오박이 제안한 홍콩에서의 새로운 계획을 듣게 된다. 여기에 마카오박이 초대하지 않은 손님, 감옥에서 막 출소한 금고털이 팹시가 합류하고 5명은 각자 인생 최고의 반전을 꿈꾸며 홍콩으로 향한다. 홍콩에서 한국 도둑들을 기다리고 있는 4인조 중국도둑 첸, 앤드류, 쥴리, 조니. 최고의 전문가들이 세팅된 가운데 서로에 대한 경계를 늦추지 않는 한국과 중국의 도둑들. 팽팽히 흐르는 긴장감 속에 나타난 마카오박은 자신이 계획한 목표물을 밝힌다. 그것은 마카오 카지노에 숨겨진 희대의 다이아몬드 <태양의 눈물>. 성공을 장담할 수 없는 위험천만한 계획이지만 2천만 달러의 달콤한 제안을 거부할 수 없는 이들은 태양의 눈물을 훔치기 위한 작업에 착수한다. 그러나 진짜 의도를 알 수 없는 비밀스런 마카오박과 그런 마카오박의 뒤통수를 노리는 뽀빠이, 마카오박에게 배신당한 과거의 기억을 잊지 못하는 팹시와 팀보다 눈 앞의 현찰을 먼저 챙기는 예니콜, 그리고 한국 도둑들을 믿지 않는 첸과 중국 도둑들까지. 훔치기 위해 모였지만 목적은 서로 다른 10인의 도둑들은 서서히 자신만의 플랜을 세우기 시작하는데…",2012/07/25,93672497700,12984701,1091,155487,한국,(주)쇼박스,8,7.05,7.64,7.9,1,20665008000,2858081,1072,24481,20737399000,2866756,29046371500,4017061,1091,36056,49783770500,6883817,16997363000,2353543,1041,29089,66781133500,9237360,액션,432,최동훈
10,20127593,7번방의 선물,"최악의 흉악범들이 모인 교도소 7번방에 이상한 놈이 들어왔다! 그는 바로 6살 지능의 딸바보 '용구'! 평생 죄만 짓고 살아온 7번방 패밀리들에게 떨어진 미션은 바로 '용구' 딸 '예승'이를 외부인 절대 출입금지인 교도소에 반.입.하.는.것! 2013년 새해, 웃음과 감동 가득한 사상초유의 합동작전이 시작된다!",2013/01/23,91437368170,12812144,866,167013,한국,(주)넥스트엔터테인먼트월드(NEW),,6.58,8.83,8.7,1,12626773202,1731352,787,16025,12699679202,1740047,17419538777,2451850,866,25372,30119217979,4191897,15197937191,2089485,802,25107,45317155170,6281382,코미디,230,이환경
11,20183867,알라딘,"키우는 원숭이 아부와 함께 살아가는 아그라바의 좀도둑 알라딘은 어느 날 궁궐을 탈출한 술탄의 딸 자스민에게 한눈에 반한다. 술탄의 자리를 노리고 있는 사악한 마법사 자파는 알라딘을 눈여겨보고 그에게 마법의 램프를 가져다주면 부자로 만들어주겠다고 말한다. 동굴에 들어가서 램프를 찾던 알라딘은 도중에 동굴이 무너지는 바람에 갇히게 된다. 위기에 빠진 알라딘은 램프의 요정 지니와 마법 양탄자의 도움으로 동굴에서 탈출한다. 지니의 주인이 된 알라딘은 지니를 램프에서 구해주겠다고 약속하고, 지니의 힘을 빌어 왕자로 변신해 자스민에게 청혼하기 위해 아그라바로 돌아온다. 알라딘 때문에 자신의 계획이 실패로 돌아갈 위기에 처하자 자파는 알라딘을 붙잡아 바다에 던지는데...",2019/05/23,108161000000,12723777,1409,282221,미국,월트디즈니컴퍼니코리아,9.42,6,9.38,8.4,1,7801728760,873717,1311,19392,7803828760,874017,10213638472,1275982,1146,25967,18017467232,2149999,14918691107,1749541,1371,27245,32936158339,3899540,어드벤처,0,가이 리치
12,20148851,암살,"1933년 조국이 사라진 시대 대한민국 임시정부는 일본 측에 노출되지 않은 세 명을 암살작전에 지목한다. 한국 독립군 저격수 안옥윤, 신흥무관학교 출신 속사포, 폭탄 전문가 황덕삼! 김구의 두터운 신임을 받는 임시정부 경무국 대장 염석진은 이들을 찾아 나서기 시작한다. 암살단의 타깃은 조선주둔군 사령관 카와구치 마모루와 친일파 강인국. 한편, 누군가에게 거액의 의뢰를 받은 청부살인업자 하와이 피스톨이 암살단의 뒤를 쫓는데... 친일파 암살작전을 둘러싼 이들의 예측할 수 없는 운명이 펼쳐진다!",2015/07/22,98468661781,12706846,1519,175218,한국,(주)쇼박스,9.1,6.57,8.98,8.5,1,26598785686,3359718,1519,34286,26692706686,3370006,24511772216,3202520,1422,39868,51204478902,6572526,18597674377,2401205,1094,27514,69802153279,8973731,액션,511,최동훈
13,20124079,"광해, 왕이 된 남자","왕위를 둘러싼 권력 다툼과 붕당정치로 혼란이 극에 달한 광해군 8년. 자신의 목숨을 노리는 자들에 대한 분노와 두려움으로 점점 난폭해져 가던 왕 ‘광해’는 도승지 ‘허균’에게 자신을 대신하여 위협에 노출될 대역을 찾을 것을 지시한다. 이에 허균은 기방의 취객들 사이에 걸쭉한 만담으로 인기를 끌던 하선을 발견한다. 왕과 똑같은 외모는 물론 타고난 재주와 말솜씨로 왕의 흉내도 완벽하게 내는 하선. 영문도 모른 채 궁에 끌려간 하선은 광해군이 자리를 비운 하룻밤 가슴 조이며 왕의 대역을 하게 된다. 왕이 되어선 안 되는 남자, 조선의 왕이 되다! 그러던 어느 날 광해군이 갑자기 의식을 잃고 쓰러지는 엄청난 사건이 발생하고, 허균은 광해군이 치료를 받는 동안 하선에게 광해군을 대신하여 왕의 대역을 할 것을 명한다. 저잣거리의 한낱 만담꾼에서 하루아침에 조선의 왕이 되어버린 천민 하선. 허균의 지시 하에 말투부터 걸음걸이, 국정을 다스리는 법까지, 함부로 입을 놀려서도 들켜서도 안 되는 위험천만한 왕노릇을 시작한다. 하지만 예민하고 난폭했던 광해와는 달리 따뜻함과 인간미가 느껴지는 달라진 왕의 모습에 궁정이 조금씩 술렁이고, 점점 왕의 대역이 아닌 자신의 목소리를 내기 시작하는 하선의 모습에 허균도 당황하기 시작하는데...",2012/09/13,88913283469,12324062,1001,203464,한국,(주)씨제이이엔엠,,7.27,9.25,8.6,1,9459752500,1272584,810,14869,9503843500,1279367,14126895269,1948500,921,26701,23630738769,3227867,14710712500,2006448,935,28920,38341451269,5234315,사극,345,추창민
14,20186202,신과함께-인과 연,"천 년 동안 48명의 망자를 환생시킨 저승 삼차사, 한 명만 더 환생시키면 그들도 새로운 삶을 얻을 수 있다. 하지만 강림(하정우)은 원귀였던 수홍(김동욱)을 자신들의 마지막 귀인으로 정하는 이해할 수 없는 선택을 한다. 저승법 상 원귀는 소멸되어야 마땅하나 염라대왕(이정재)은 저승 삼차사에게 새로운 조건을 내걸며 강림의 제안을 수락한다. 염라의 조건은 성주신(마동석)이 버티고 있어 저승 차사들이 가는 족족 실패하는 허춘삼 노인을 수홍의 재판이 끝나기 전까지 저승으로 데려오는 것. 허춘삼을 데리러 이승으로 내려간 해원맥(주지훈)과 덕춘(김향기), 하지만 성주신의 막강한 힘 앞에 속수무책으로 당하기만 하던 중 우연히 그가 천 년 전 과거에 해원맥과 덕춘을 저승으로 데려간 저승 차사였다는 사실을 알게 된다. 스스로도 기억 못 하는 과거에 대한 호기심으로 해원맥과 덕춘은 성주신과 거래를 시작하는데… 이승과 저승, 현재와 과거를 오가는 천 년의 비밀이 밝혀진다!",2018/08/01,102689000000,12278010,2235,180750,한국,롯데엔터테인먼트,8.63,6.31,7.71,6.9,1,51755528737,6182041,2235,52637,51859487837,6193754,28618804912,3437475,2097,53261,80478292749,9631229,14334136860,1688614,1266,31275,94812429609,11319843,판타지,840,김용화
15,20162869,택시운전사,"택시운전사 만섭(송강호)은 외국손님을 태우고 광주에 갔다 통금 전에 돌아오면 밀린 월세를 갚을 수 있는 거금 10만원을 준다는 말에 독일기자 피터(토마스 크레취만)를 태우고 영문도 모른 채 길을 나선다. 광주 그리고 사람들. “모르겄어라, 우덜도 우덜한테 와 그라는지…” 어떻게든 택시비를 받아야 하는 만섭의 기지로 검문을 뚫고 겨우 들어선 광주. 위험하니 서울로 돌아가자는 만섭의 만류에도 피터는 대학생 재식(류준열)과 황기사(유해진)의 도움 속에 촬영을 시작한다. 그러나 상황은 점점 심각해지고 만섭은 집에 혼자 있을 딸 걱정에 점점 초조해지는데…",2017/08/02,95871553649,12189698,1906,184204,한국,(주)쇼박스,9.28,6.09,9.03,9.1,1,34080527436,4275383,1906,39846,34642953436,4361047,28053329560,3576763,1753,49731,62696282996,7937810,19114003453,2415174,1291,32066,81810286449,10352984,드라마,444,장훈
16,20156564,부산행,"정체불명의 바이러스가 전국으로 확산되고 대한민국 긴급재난경보령이 선포된 가운데, 열차에 몸을 실은 사람들은 단 하나의 안전한 도시 부산까지 살아가기 위한 치열한 사투를 벌이게 된다. 서울에서 부산까지의 거리 442KM 지키고 싶은, 지켜야만 하는 사람들의 극한의 사투!",2016/07/20,93187397548,11567662,1788,151530,한국,(주)넥스트엔터테인먼트월드(NEW),8.6,7.1,8,7.3,1,38960854076,4756585,1788,47806,43839841176,5317433,24314271163,3095401,1641,45853,68154112339,8412834,12850242929,1629987,933,21482,81004355268,10042821,액션,484,연상호
17,20134803,변호인,"1980년대 초 부산. 빽 없고, 돈 없고, 가방끈도 짧은 세무 변호사 송우석(송강호). 부동산 등기부터 세금 자문까지 남들이 뭐라든 탁월한 사업수완으로 승승장구하며 부산에서 제일 잘나가고 돈 잘 버는 변호사로 이름을 날린다. 대기업의 스카우트 제의까지 받으며 전국구 변호사 데뷔를 코 앞에 둔 송변. 하지만 우연히 7년 전 밥값 신세를 지며 정을 쌓은 국밥집 아들 진우(임시완)가 뜻하지 않은 사건에 휘말려 재판을 앞두고 있다는 소식을 듣는다. 국밥집 아줌마 순애(김영애)의 간절한 부탁을 외면할 수 없어 구치소 면회만이라도 도와주겠다고 나선 송변. 하지만 그곳에서 마주한 진우의 믿지 못할 모습에 충격을 받은 송변은 모두가 회피하기 바빴던 사건의 변호를 맡기로 결심하는데... “제가 하께요, 변호인. 하겠습니더”",2013/12/18,82875748788,11375223,925,152285,한국,(주)넥스트엔터테인먼트월드(NEW),9.29,7.43,9,9.3,1,12609602500,1733598,923,17449,12736708500,1751796,22735168000,3145173,911,28998,35471876500,4896969,21734816000,2962186,925,30339,57206692500,7859155,드라마,275,양우석
18,20090074,해운대,"2004년 역사상 유례없는 최대의 사상자를 내며 전세계에 엄청난 충격을 안겨준 인도네시아 쓰나미. 당시 인도양에 원양어선을 타고 나갔던 해운대 토박이 만식은 예기치 못한 쓰나미에 휩쓸리게 되고, 단 한 순간의 실수로 그가 믿고 의지했던 연희 아버지를 잃고 만다. 이 사고 때문에 그는 연희를 좋아하면서도 자신의 마음을 숨길 수 밖에 없다. 그러던 어느 날, 만식은 오랫동안 가슴 속에 담아두었던 자신의 마음을 전하기로 결심하고 연희를 위해 멋진 프로포즈를 준비한다. 한편 국제해양연구소의 지질학자 김휘 박사는 대마도와 해운대를 둘러싼 동해의 상황이 5년전 발생했던 인도네시아 쓰나미와 흡사하다는 엄청난 사실을 발견하게 된다. 그는 대한민국도 쓰나미에 안전하지 않다고 수차례 강조하지만 그의 경고에도 불구하고 재난 방재청은 지질학적 통계적으로 쓰나미가 한반도를 덮칠 확률은 없다고 단언한다. 그 순간에도 바다의 상황은 시시각각 변해가고, 마침내 김휘 박사의 주장대로 일본 대마도가 내려 앉으면서 초대형 쓰나미가 생성된다. 한여름 더위를 식히고 있는 수백만의 휴가철 인파와 평화로운 일상을 보내고 있는 부산 시민들, 그리고 이제 막 서로의 마음을 확인한 만식과 연희를 향해 초대형 쓰나미가 시속 800km의 빠른 속도로 밀려오는데… 가장 행복한 순간 닥쳐온 엄청난 시련, 남은 시간은 단 10분! 그들은 가장 소중한 것을 지켜내야만 한다!",2009/07/22,81027925000,11324958,764,154329,한국,(주)씨제이이엔엠,,6.29,7.44,6.9,1,14214872500,1985336,754,17915,14282422500,1995138,20014562500,2800670,764,25602,34296985000,4795808,18788230500,2631369,654,24704,53085215500,7427177,액션,454,윤제균
19,20177478,어벤져스: 인피니티 워,"새로운 조합을 이룬 어벤져스, 역대 최강 빌런 타노스에 맞서 세계의 운명이 걸린 인피니티 스톤을 향한 무한 대결이 펼쳐진다! 마블의 클라이맥스를 목격하라!",2018/04/25,100081000000,11233176,2553,243677,미국,월트디즈니컴퍼니코리아,9.08,7.09,8.96,7.7,1,41768335531,4764495,2553,61375,41768335531,4764495,33547933613,3733415,2462,75829,75316269144,8497910,15205654257,1636058,2122,56137,90521923401,10133968,액션,0,안소니 루소
20,20060151,괴물,"햇살 가득한 평화로운 한강 둔치 아버지(변희봉)가 운영하는 한강 매점, 늘어지게 낮잠 자던 강두(송강호)는 잠결에 들리는 ‘아빠’라는 소리에 벌떡 일어난다. 올해 중학생이 된 딸 현서(고아성)가 잔뜩 화가 나있다. 꺼내놓기도 창피한 오래된 핸드폰과, 학부모 참관 수업에 술 냄새 풍기며 온 삼촌(박해일)때문이다. 강두는 고민 끝에 비밀리에 모아 온 동전이 가득 담긴 컵라면 그릇을 꺼내 보인다. 그러나 현서는 시큰둥할 뿐, 막 시작된 고모(배두나)의 전국체전 양궁경기에 몰두해 버린다. 그곳에서 괴물이 나타났다. 한강 둔치로 오징어 배달을 나간 강두, 우연히 웅성웅성 모여있는 사람들 속에서 특이한 광경을 목격하게 된다. 생전 보도 못한 무언가가 한강다리에 매달려 움직이는 것이다. 사람들은 마냥 신기해하며 핸드폰, 디카로 정신 없이 찍어댄다. 그러나 그것도 잠시… 정체를 알 수 없는 괴물은 둔치 위로 올라와 사람들을 거침없이 깔아뭉개고, 무차별로 물어뜯기 시작한다. 순식간에 아수라장으로 돌변하는 한강변. 강두도 뒤늦게 딸 현서를 데리고 정신 없이 도망가지만, 비명을 지르며 흩어지는 사람들 속에서, 꼭 잡았던 현서의 손을 놓치고 만다. 그 순간 괴물은 기다렸다는 듯이 현서를 낚아채 유유히 한강으로 사라진다. 어딘가에 있을 현서를 반드시 찾아야 한다. 갑작스런 괴물의 출현으로 한강은 모두 폐쇄되고, 도시 전체는 마비된다. 하루아침에 집과 생계, 그리고 가장 소중한 현서까지 모든 것을 잃게 된 강두 가족… 돈도 없고 빽도 없는 그들은 아무도 도와주지 않지만, 위험구역으로 선포된 한강 어딘가에 있을 현서를 찾아 나선다.",2006/07/27,66717700300,10917400,647,113105,한국,(주)쇼박스,,8,8.62,8.9,1,13994394300,2260853,618,14369,14056618300,2269855,21060454300,3441793,647,24157,35117072600,5711648,12355840100,2031846,564,21535,47472912700,7743494,SF,351,봉준호
